"St.Clement’s Redemptorist College, Laurel Hill Avenue, South Circular Road, Limerick",St Clements Redemptorist College,ChIJt8QHr4NcW0gRpt0IK75R17c,70,1,0,0,19,0,2,1,0,0,0,0,0,0,0,0,0,0,0,0,0,0,1,0,18,0,0,3,0,0,45,0.64
"Coláiste Nano Nagle, Sexton Street, Limerick ",Coláiste Nano Nagle,ChIJ2fl3iGVcW0gR9uoFKtwBQyU,38,0,0,1,8,0,0,0,0,0,0,0,0,0,0,0,0,0,1,0,0,0,0,0,11,0,0,3,0,0,24,0.63
"Ard Scoil Mhuire, Corbally, Limerick",Ardscoil Mhuire,ChIJb3DZS0BcW0gRVqfSyHg8Fqc,41,0,0,0,6,0,0,0,0,0,0,0,0,0,0,0,0,0,1,0,0,0,0,0,10,0,0,6,0,0,23,0.56
"Mean Scoil Maria Auxiliatrix, Fernbank, North Circular Road, Limerick City",Salesian Secondary School,ChIJGwSBP2BcW0gRsbvB81R-3hI,81,0,0,0,17,0,0,3,0,0,0,0,0,0,0,0,1,0,1,0,0,0,2,0,12,0,0,4,0,0,40,0.49
"Col.Mhic. na Braithre Criostai, Sraid Seasnain, Cathair Luimnigh",Maryland Home Improvement Commission,ChIJ93JJgpkEyIkR0sGzLTRSpsg,66,0,0,0,10,0,0,0,0,0,0,0,0,0,0,0,0,0,1,0,0,0,0,0,21,0,0,0,0,0,32,0.48
"St Nessan’s Community School, Moylish Park, Limerick City",Thomond Community College,ChIJ2bBKkPlcW0gR3e46wWl9gt8,35,0,0,0,4,0,0,0,0,0,0,0,0,1,0,0,0,0,0,0,0,0,0,0,10,0,0,1,0,0,16,0.46
"Coláiste Naomh Mel, Longford",Saint Mel's College,ChIJL4rHCZzTXUgRo-2-as3FDfQ,65,4,1,2,2,8,6,0,0,0,0,1,0,9,0,6,0,1,13,0,0,2,0,0,1,0,0,0,0,1,57,0.88
"Community College, Lanesboro, Longford",Lanesborough Community College,ChIJk7DbmmkuXEgRxF6BlnAkFPo,28,3,1,4,2,1,1,0,0,0,0,0,0,0,0,3,0,0,4,0,0,1,0,0,2,0,0,1,1,0,24,0.86
"Méan Scoil Mhuire, Convent Road, Longford",Mean Scoil Mhuire,ChIJ8UD2_J7TXUgRtIMu5rB25ng,92,15,1,12,1,12,3,3,0,0,0,0,0,2,0,6,0,0,11,0,0,4,0,0,0,1,0,3,0,0,74,0.8
"Moyne Community School, Moyne",Moyne Community School,ChIJB-HNPiR3XkgROXSoL3we34M,118,1,8,6,2,10,10,1,0,0,0,0,0,8,0,10,0,2,9,1,0,7,1,5,1,1,1,0,0,0,84,0.71
"Mercy Secondary School, Ballymahon, Longford",Mercy Secondary School,ChIJHb9CqHvLXUgR2pIq5cMRp9I,84,4,2,8,2,4,5,0,0,0,0,0,0,5,0,11,0,0,8,0,0,5,0,0,3,0,0,0,0,0,57,0.68
"Ballymahon Vocational School, Ballymahon, Longford",Ballymahon Vocational School,ChIJHb9CqHvLXUgR2eOPg17QjQQ,48,1,1,0,3,3,1,0,0,0,0,0,0,1,0,9,0,0,3,1,0,3,1,1,2,1,0,1,0,0,32,0.67
"Cnoc Mhuire, Clochar na Trocaire, Granard",Cnoc Mhuire Secondary School,ChIJuQA6p5beXUgROx8ON_ha3mE,83,0,5,4,0,10,7,0,1,0,1,1,0,4,0,2,0,0,2,0,2,10,1,1,0,0,0,0,0,0,51,0.61
"Templemichael College, Templemichael, Longford",Templemichael College,ChIJ1YQ2e5DTXUgRKNtcugsHR0Y,13,0,0,0,0,0,2,0,0,0,0,0,0,0,0,4,0,0,1,0,0,0,0,0,0,0,0,0,0,0,7,0.54
"Ardscoil Phadraig, Granard, Longford",Ardscoil Phadraig,ChIJP16EbpbeXUgRTpklrT9rfBs,27,0,0,0,0,0,1,0,0,0,0,0,0,0,0,2,0,0,2,0,0,3,0,0,0,0,0,0,0,0,8,0.3
"*Drogheda Grammar School, Eden View, Mornington, Drogheda",Drogheda Grammar School,ChIJiUYDul46Z0gRIUAEsIDoU4Q,27,5,0,1,0,6,0,0,0,0,0,0,0,4,0,0,0,5,0,0,1,0,3,0,1,0,0,0,0,0,26,0.96
"Coláiste Ris, Chapel Street, Dundalk",Coláiste Rís,ChIJF3koAqTOYEgRH3jaXSMARe8,93,3,8,11,0,17,2,0,0,0,0,0,0,3,0,0,0,40,1,0,1,0,0,1,1,0,0,0,0,0,88,0.95
"Mean Scoil Naomh Uinseann, Seatown Place, Dundalk",St Vincent's Secondary School,ChIJF0kWdJ_OYEgRLUHkNEgXInc,142,6,10,26,0,22,9,0,0,1,3,2,1,5,0,0,0,42,0,0,2,1,0,0,0,2,1,0,0,1,134,0.94
"De La Salle Secondary School, Dundalk",De La Salle College,ChIJx4-grLTOYEgRnskHs4QbXqk,133,8,1,19,0,14,0,1,0,1,0,2,0,7,0,1,1,55,1,0,2,0,0,0,0,1,0,0,0,0,114,0.86
"Sacred Heart School, Sunnyside,, Drogheda",Sacred Heart Secondary School,ChIJ0ddXmiU6Z0gRPOL9oeI9y5w,105,8,14,9,0,8,4,0,0,1,0,3,1,7,1,0,0,24,1,3,0,0,0,1,1,0,1,0,1,0,88,0.84
"Our Lady’s College, Greenhills, Drogheda",Our Lady's College,ChIJ2WxwiT86Z0gRxDuWSeg-ZCE,154,6,8,22,1,24,3,0,0,1,1,2,1,15,0,2,1,26,0,0,3,1,0,1,1,0,1,0,3,1,124,0.81
"*Dundalk Grammar School, Dundalk",Dundalk Grammar School,ChIJbdK7HAPMYEgR5cfQoqc9pIg,75,9,5,6,0,7,10,1,0,0,0,1,0,5,1,0,0,8,1,1,0,0,0,0,0,0,0,0,1,1,57,0.76
"Ardee Community School, Ardee, Drogheda",Ardee Community School,ChIJWRvnbVlKZ0gRVaJkPesnXQ8,103,2,1,11,1,4,0,0,0,0,0,1,0,7,0,0,2,39,1,0,2,0,0,1,0,1,0,0,3,0,76,0.74
"St Mary’s Diocesan School, Beamore Road, Drogheda",Saint Mary's Diocesan School,ChIJCXAm6Sg6Z0gR2xs8UfZ8YNM,148,4,7,16,0,7,2,1,0,0,0,2,1,13,0,0,0,45,2,1,2,0,1,1,0,2,1,0,0,0,108,0.73
"St Louis Secondary School, Dundalk",St Louis Secondary School,ChIJnfeyiKfOYEgRle_fACTAZKM,88,6,4,13,0,11,1,0,0,0,0,0,0,5,0,0,0,22,0,0,0,0,0,0,0,0,1,0,0,0,63,0.72
"O Fiaich College, Dublin Road, Dundalk",O'Fiaich College,ChIJzYxJgBTMYEgRhRJXS-M2UNA,46,0,1,0,0,1,0,0,0,0,2,1,1,2,0,0,0,18,0,0,1,0,0,3,0,0,0,0,1,0,31,0.67
"Scoil Uí Mhuirí, Dunleer, Drogheda",Scoil Ui Mhuiri,ChIJib2--gI0Z0gRx_FV7FGTMSk,111,2,3,8,1,9,1,0,0,0,0,0,1,7,1,0,0,33,1,1,2,1,1,1,0,0,0,0,1,0,74,0.67
"Bush Post Primary, Bush, Riverstown, Dundalk",Bush Post Primary School,ChIJj6eln1hKZ0gRXcRgkT8P2II,84,1,0,5,2,3,1,0,0,1,0,3,0,6,0,2,0,22,1,1,0,0,0,2,0,3,0,0,0,0,53,0.63
"St. Joseph’s Secondary School, Newfoundwell, Drogheda",St Josephs Secondary School,ChIJr8GcqRU6Z0gRJvAT0npO5Bg,81,4,1,4,0,3,0,0,0,0,0,0,0,3,0,1,0,27,0,1,3,1,1,2,0,0,0,0,0,0,51,0.63
"St Oliver’s Community College, Rathmullen Road, Drogheda",St Oliver's community College,ChIJv4ZzdpY5Z0gRhdlJYu9Sn6k,165,5,6,16,0,11,1,0,0,0,0,5,1,11,1,2,0,36,1,0,0,1,0,0,1,0,0,0,1,0,99,0.6
"St Mary’s College, St. Mary’s Road, Dundalk",St Mary's College,ChIJeVOC9KPOYEgRKXkqtvnfNj8,128,5,0,10,1,1,3,0,0,0,0,0,1,7,0,0,0,38,0,2,1,0,0,1,0,0,0,0,3,0,73,0.57
"Secondary School, Balla, Castlebar",Balla Secondary School,ChIJex5iWNlaWUgR0aKBSlnp3vY,44,1,0,1,6,3,13,0,0,0,0,0,0,0,0,2,0,0,18,0,0,4,0,0,1,1,0,0,0,0,50,1.14
"Coláiste Cholmain, Chlar Chlainne Mhuiris",Colaiste Cholmain,ChIJI7jtUHb9W0gRN2eWK7mt670,39,6,1,2,6,1,8,0,0,0,0,0,0,0,0,1,0,0,7,0,0,2,2,0,1,0,0,3,0,0,40,1.03
"St Gerald’s College, Newport Road, Castlebar",St. Gerald's College Castlebar,ChIJiacn03hdWUgRpMFfErs_nE4,80,4,2,8,17,2,24,1,0,0,0,0,0,1,0,1,0,0,10,1,1,5,0,0,2,1,0,1,0,0,81,1.01
"St Joseph’s Secondary School, Castlebar",St Joseph's Secondary School,ChIJR2wof6BdWUgRFuUVUusdRl0,42,2,4,7,4,0,14,0,0,0,0,1,0,0,0,2,0,0,3,0,0,1,0,0,2,0,1,1,0,0,42,1
"Rice College, Westport",Rice College,ChIJZRYHDJlkWUgREsgK6mNEC6Q,80,1,1,0,11,1,10,0,0,0,0,0,1,4,1,1,2,0,28,0,0,8,0,1,1,0,0,0,0,0,71,0.89
"St Brendan’s College, Belmullet",Saint Brendan's College,ChIJ_UpVfGmoWUgRSP6zCI0f7B8,37,2,0,1,3,0,10,0,0,0,0,0,0,1,0,0,0,0,11,0,0,3,0,0,1,0,0,0,0,0,32,0.86
"Our Lady’s Secondary School, Logmore, Belmullet via Ballina",Our Lady's Secondary School,ChIJteRW3mioWUgRLq14OsVYdns,47,3,0,5,1,2,10,0,1,0,0,0,0,2,0,0,0,0,8,0,1,5,0,0,0,0,0,0,0,1,39,0.83
"Scoil na Maighdine Muire, Clochar na Trocaire, Beal an Atha",Scoil na Maighdine Mhuire,ChIJARw7yalrW0gRMFIcfMVEdbA,105,6,3,14,5,5,13,2,1,0,0,0,0,2,0,2,2,2,12,0,1,13,0,1,0,0,0,3,0,0,87,0.83
"Coláiste Pobail Acla, Polranny, Achill Sound, Mayo",Coláiste Pobail Acla,ChIJSTHSGiacWUgRnraLwoJGrFc,34,1,1,1,5,2,3,0,0,0,0,0,0,1,0,0,0,0,4,0,0,9,0,0,1,0,0,0,0,0,28,0.82
"St. Louis Community School, Kiltimagh, Claremorris",St Louis Community School,ChIJtUCAQzlRWUgR4upMfO0gRuY,84,3,3,6,10,2,11,0,1,0,0,0,0,3,0,1,0,0,9,0,1,7,1,3,4,1,1,1,0,1,69,0.82
"Scoil Cnocán Mhichil Naofa, Clár Chlainne Mhuiris",Claremorris,ChIJ4zlDdhL9W0gR0PIxl6nHAAo,71,0,5,3,8,2,12,1,2,0,0,0,0,1,0,0,0,0,10,1,0,4,1,1,1,0,0,5,0,0,57,0.8
"St. Joseph’s Secondary School, Foxford",St Josephs Secondary School,ChIJhwgozUJPWUgRu0KVuAoGQr8,70,3,1,4,3,0,11,0,0,0,0,0,0,1,0,2,0,0,13,0,0,15,0,1,1,0,0,1,0,0,56,0.8
"Ballyhaunis Community School, Knock Road, Ballyhaunis",Ballyhaunis Community School,ChIJJ9nOTJ6qXkgR-N-l5Lze62M,87,2,1,1,8,1,25,1,1,0,0,0,0,0,0,2,0,0,14,0,1,7,1,1,1,0,0,2,0,0,69,0.79
"Scoil an Chroi Naofa, Cathair na Mart",Scoil an Chroi Naofa,ChIJhScOOc5pXEgRh3bhjV2I2fw,90,5,1,4,19,0,12,0,0,0,1,0,0,2,0,3,1,0,8,1,0,7,0,0,2,1,0,3,0,0,70,0.78
"Davitt College, Springfield, Castlebar, Co.Mayo ",Davitt College VEC,ChIJn5_OaApdWUgRpp_8gbDNmrE,123,8,2,3,16,2,17,3,1,0,0,0,0,2,0,3,0,0,16,0,3,10,0,3,0,0,0,3,0,0,92,0.75
"Mean Scoil Sancta Maria, Cluain Cearbhan, Cathair na Mart",Cloyne,ChIJ30uxqmR8Q0gRoPIxl6nHAAo,51,3,1,1,8,0,2,0,0,0,0,0,0,1,0,1,0,0,14,0,0,5,0,0,0,0,0,0,1,1,38,0.75
"Scoil Muire agus Padraig, Swinford, Co.Mayo",Scoil Muire agus Padraig,ChIJ54H_QZdNWUgRJ9AX3UEp5-Q,72,2,0,4,5,0,20,0,0,0,0,0,0,1,0,3,1,0,6,0,4,6,0,0,0,0,0,1,0,0,53,0.74
"Jesus and Mary Secondary School, Gortnor Abbey, Crossmolina","Jesus & Mary Secondary School, Gortnor Abbey",ChIJu-4lRxQ_WUgRRLowX4EVpCg,74,2,2,4,2,3,12,0,0,0,0,0,0,0,0,0,0,0,17,0,0,10,0,0,1,0,0,1,0,0,54,0.73
"St Patrick’s College, Lacken Cross, Killala",Lacken Cross (Opp St Patricks),ChIJFb8uARg7WUgRa3nG1VC6w_Q,32,0,1,1,2,0,3,0,0,0,0,0,0,0,0,0,0,0,6,0,0,5,0,3,0,0,0,1,0,1,23,0.72
"Community School, Convent Road, Ballinrobe",Ballinrobe Community School,ChIJG5AKuT_nW0gR3a0TlSTCScs,101,7,1,1,5,0,27,0,0,0,0,1,0,3,0,1,1,0,12,0,2,0,1,2,4,1,0,2,0,0,71,0.7
"St.Joseph’s Community College, Charlestown",St Joseph's Community College,ChIJ0ydEOUGyXkgRpKDo3w1fmJU,49,0,0,0,0,1,13,0,0,0,0,0,0,2,0,0,0,0,11,0,0,4,0,0,0,0,1,0,0,0,32,0.65
"Coláiste Muire, Tuar Mhic Eadaigh, Clar Chlainne Mhuiris",Coláiste Muire,ChIJ3dKOTN3eW0gRd7IrtvAfaXU,13,1,0,2,1,0,0,0,0,0,0,0,0,0,0,0,0,0,0,0,1,2,0,0,0,0,0,1,0,0,8,0.62
"St Muredach’s College, Sligo Road, Ballina",St. Muredach's College,ChIJByzASrs3WUgRFZwhmRAefT0,80,2,0,4,4,0,6,0,0,0,0,0,0,1,0,2,0,0,12,0,1,10,0,0,1,1,0,1,0,0,45,0.56
"St. Tiernan’s College, Crossmolina, Ballina",St. Tiernan's College,ChIJ6-gVxz8_WUgR8pcwh860eWE,36,0,1,0,0,0,0,0,0,0,0,0,0,1,0,1,0,0,4,0,0,6,0,0,0,0,0,0,0,0,13,0.36
"Eureka Secondary School, Convent Of Mercy, Kells",Eureka Secondary School,ChIJrR0Hn0hbZ0gRDdg7X2JcfAg,120,16,7,17,3,20,7,2,0,0,0,4,2,6,1,3,0,14,2,2,2,1,0,1,2,1,3,0,0,1,117,0.98
"St. Peter’s College, Dunboyne",St. Peter's College,ChIJ6xig1bptZ0gRmVO7lvyOLqY,161,9,14,22,1,46,1,0,1,0,0,12,1,27,0,1,1,0,2,2,1,0,0,1,0,0,0,0,1,0,143,0.89
"Loreto Secondary School, St. Michael’s, Navan",Loreto Secondary School,ChIJ696ZlbNEZ0gRq38VSLkgvSY,134,22,14,29,0,14,1,1,0,0,0,6,0,12,1,1,1,10,0,1,0,2,0,1,0,0,1,0,1,0,118,0.88
"Ashbourne Community School, Deerpark, Ashbourne",Ashbourne Community School,ChIJNSUMYeoUZ0gRkX5jxqKNOaA,152,8,13,21,1,24,1,2,0,0,0,11,5,22,1,0,0,4,2,1,1,0,1,0,0,1,2,1,4,0,126,0.83
"Scoil Mhuire, Patrick’s Street, Trim",Scoil Mhuire,ChIJ_YIPtxteZ0gRDOJgwEOo4d4,109,8,8,16,1,28,1,0,1,0,0,5,1,7,1,3,0,2,1,0,2,0,0,0,0,3,0,0,1,0,89,0.82
"Ratoath College, Jamestown, Ratoath",Ratoath College,ChIJn6M3YhNrZ0gRquqq8EfqXo4,188,8,14,20,1,38,0,1,0,0,0,9,8,41,1,0,0,4,0,1,0,0,0,1,0,0,1,1,0,0,149,0.79
"St Patrick’s Classical School, Moatlands, Navan",St Patricks Classical School,ChIJa1VU50VbZ0gRv4HU_SqSXtQ,171,13,4,24,1,25,9,0,0,0,0,7,1,13,1,2,0,22,1,1,6,0,0,1,1,2,0,0,1,0,135,0.79
"Dunshaughlin Community College, Dunshaughlin",Dunshaughlin Community College,ChIJAbkrSH9pZ0gRon1i59TeZIE,163,18,5,16,1,30,3,0,0,0,0,14,0,12,1,3,0,7,3,1,1,2,0,0,0,0,0,0,1,1,119,0.73
"St Joseph’s Mercy Secondary School, Brews Hill, Navan",St Josephs Mercy Secondary School,ChIJlaO5U0tbZ0gR8xRoyOjh5cA,106,7,5,9,2,14,5,0,0,0,0,2,1,7,1,1,0,10,1,2,1,1,0,1,2,1,3,0,0,0,76,0.72
"Athboy Community School, Athboy",Athboy Community School,ChIJofv_hOL1XUgRhDg62Tyia6k,75,1,1,2,0,18,1,0,0,0,0,3,1,3,1,8,0,6,2,1,2,0,0,0,1,1,1,0,0,0,53,0.71
"St Ciaran’s Comm. School, Navan Rd., Kells",St Ciarans Community School,ChIJrR0Hn0hbZ0gR0XOQjVaqj5Q,102,2,3,8,2,10,3,0,0,0,0,14,1,4,0,2,0,14,3,0,3,0,0,0,0,0,1,0,0,1,71,0.7
"Coláiste San Froinsias, Baile Mhic Gormain",Gormanston,ChIJGc36hsg8Z0gR3sUgSz8vZa8,46,1,4,2,0,9,2,1,0,0,0,0,0,4,0,0,0,5,1,1,1,0,0,1,0,0,0,0,0,0,32,0.7
"Boyne Community School, Dublin Road, Trim",Boyne Community School,ChIJxZz1rgReZ0gR6fX9KlivnSg,118,9,5,9,3,21,2,0,0,0,0,7,1,11,0,5,0,2,0,1,4,0,0,0,0,0,0,0,1,1,82,0.69
"St Oliver’s Post Primary Sch., Oldcastle",St Oliver Post Primary,ChIJtS3M9k77XUgRlrOQs25p3r0,94,3,1,8,1,8,4,1,0,0,0,0,1,10,0,7,0,4,4,3,0,4,0,1,0,2,2,0,0,0,64,0.68
"O’Carolan College, Nobber, Kells",O'Carolan College,ChIJsygIAhdSZ0gR90HSsVPoKz4,108,1,3,10,2,8,3,0,2,0,0,3,0,11,0,2,0,14,0,1,2,5,2,0,0,0,0,0,0,0,69,0.64
"Coláiste na Hinse, Bettystown",Colaiste Na Hinse,ChIJc4v52i47Z0gR7ueVTS8TepM,105,4,5,11,1,5,3,0,0,0,0,5,3,10,1,1,0,13,1,0,1,0,0,0,1,0,0,0,0,0,65,0.62
"Beaufort College, An Uaimh",Beaufort College,ChIJ8YmunlNbZ0gRAQ0qkoDo7iI,82,0,1,2,1,8,0,0,0,0,0,8,2,5,0,2,0,13,0,1,1,1,0,0,1,0,0,0,0,0,46,0.57
"St. Fintina’s Post Primary, Longwood, Enfield",Coláiste Chlavin,ChIJZTYSybWJXUgR8SVOGP6EzLo,53,1,2,0,0,4,0,0,0,0,0,0,0,3,1,9,0,0,0,0,1,0,0,0,1,0,0,0,1,0,23,0.43
"Colaiste Pobail Ráth Chairn, Rath Cairn, Ath Buí",Coláiste Pobail Rathcairn,ChIJddL5xDFfZ0gRFO6AkFSKdAc,38,2,1,0,0,0,0,0,0,0,0,5,0,0,0,0,0,0,0,1,0,0,0,0,0,2,0,0,0,0,11,0.29
"Our Lady’s Secondary School, Laurel Hill, Castleblayney",Our Lady's Secondary School,ChIJM5O6HwG7YEgRGvLvoq9U3eg,112,16,8,19,0,6,4,1,0,1,0,0,0,9,0,1,0,22,1,0,3,8,0,5,1,1,1,0,2,0,109,0.97
"Coláiste Oiriall, An Champas Oideachais, Cnoc an Chonnaidh, Muineachán",Coláiste Oiriall,ChIJjyxdtMyYYEgR9UVhZztvca0,39,3,1,7,0,6,2,0,0,0,0,1,0,4,0,0,0,8,2,0,0,0,0,1,0,1,1,0,0,0,37,0.95
"St Louis Secondary School, Monaghan",St Louis Secondary School,ChIJPw7LHESfYEgRcsLAyI-4pW0,65,10,2,12,0,4,2,0,2,1,3,0,0,4,0,1,0,10,0,0,0,2,0,2,1,0,0,1,1,1,59,0.91
"Ard Sc na mBraithre N Padraig, Carraig Mhachaire Rois",South Carolina,ChIJ49ExeWml-IgRnhcF9TKh_7k,66,3,2,11,1,14,1,0,0,0,0,1,0,2,1,0,1,13,1,1,1,2,0,1,2,0,0,0,0,1,59,0.89
"Coláiste Pobal, Beal Atha Beithe",Ballybay,ChIJJZs_LhikYEgRQUZ-llOXBGI,30,0,0,5,2,2,0,0,0,0,0,0,0,5,0,4,0,4,2,0,0,1,0,1,0,0,0,0,0,0,26,0.87
"St. Macartan’s College, Monaghan",St Macartan's College,ChIJVyzSHESfYEgRpXZ68OvAbHI,109,16,0,10,0,6,9,0,0,2,2,0,0,10,0,1,0,20,2,2,0,8,0,3,1,0,0,0,1,0,93,0.85
"Clochar Naomh Lughaidh, Carraig Mhachaire Rois",Carrickmacross,ChIJA5cNXTCyYEgRQOkxl6nHAAo,95,5,3,17,0,13,5,0,0,0,1,0,0,8,0,0,0,14,3,1,0,0,0,4,1,0,0,1,2,0,78,0.82
"*Monaghan Collegiate School, Corlatt, Monaghan",Monaghan Collegiate School,ChIJrasl9JqnYEgRRNrUhilh-7Q,38,4,2,3,2,1,0,0,0,2,3,0,0,3,1,0,0,4,2,0,0,0,0,3,0,0,0,0,0,0,30,0.79
"Largy College, Clones",Largy College,ChIJK2g1eFYYXkgR7u3iSAxGj3E,69,3,1,12,1,1,4,0,0,1,1,0,0,7,0,0,0,3,4,0,1,6,0,3,1,0,2,0,0,0,51,0.74
"An Ghairmscoil Inver College, Carraig Mhachaire Rois",Inver College,ChIJ1ckK7SWyYEgRuYEo6KZgSR0,64,1,0,2,0,2,2,0,0,0,0,0,0,2,1,0,1,27,2,0,0,0,0,0,1,0,0,1,0,0,42,0.66
"Beech Hill College, Monaghan",Beech Hill College,ChIJPw7LHESfYEgRm53R9yFc46w,77,2,1,4,2,1,0,0,0,0,1,0,1,2,0,1,0,19,0,0,1,4,0,2,1,0,0,0,1,0,43,0.56
"Castleblayney College, Castleblayney",Castleblayney College,ChIJW48QxFS6YEgRNhYroQYIojQ,49,2,1,2,0,0,0,0,0,0,0,0,0,3,0,1,0,9,0,0,0,4,0,2,0,0,0,1,0,0,25,0.51
"Banagher College Coláiste na Sionna, Banagher Community College, Banagher",Banagher College - Coláiste na Sionna,ChIJi7ip2QpZXEgRr1jrNFKKZ0w,71,4,1,2,5,1,10,1,0,0,0,0,0,0,1,10,1,0,13,1,2,0,1,0,4,2,0,6,0,0,65,0.92
"St. Mary’s Secondary School, Edenderry, Co.Offaly",St Marys Secondary School,ChIJmektSE6FXUgRnjyqVGMinx4,136,7,4,16,7,22,9,0,0,0,0,2,0,10,1,14,0,5,2,2,4,2,0,0,1,8,0,2,0,0,118,0.87
"Sacred Heart Secondary School, Daingean Road, Tullamore",Sacred Heart School,ChIJzTVF1JqlXUgR3PN0Ly1KJnY,109,6,1,10,9,12,13,5,1,0,0,0,0,7,0,11,0,0,4,0,6,1,0,1,1,0,0,2,1,0,91,0.83
"St Brendan’s Community School, Cappaneale, Birr",Saint Brendan's Community School,ChIJgdhURov3XEgRH-QpZp3WTCs,133,6,3,5,15,4,17,0,0,0,0,1,0,4,0,13,0,1,6,1,3,0,1,0,15,5,0,8,0,0,108,0.81
"Killina Secondary School, Rahan, Tullamore",Killina Presentation Secondary School,ChIJ_Z3QiKavXUgRL3i9R6l7FJg,85,3,1,7,3,10,5,4,1,0,0,0,0,4,0,19,0,1,2,1,2,2,0,0,0,1,0,2,0,0,68,0.8
"Ard Scoil Chiarain Naofa, Frederick St, Clara",Ard Scoil Chiaráin Naofa,ChIJU1PPkeyxXUgRFsI0UvSd2zA,34,0,1,1,0,4,4,0,0,0,0,0,0,0,0,10,0,0,2,0,3,0,0,0,1,0,0,0,0,0,26,0.76
"Gallen Community School, Ferbane",Gallen Community School,ChIJlVUpjC9SXEgRGIxKVluoPVQ,70,1,2,1,2,3,7,0,1,0,0,0,0,0,0,18,0,1,7,0,1,2,0,1,2,1,1,2,0,0,53,0.76
"Coláiste Naomh Cormac, Cill Chormac, Birr",Coláiste Naomh Cormac,ChIJH142YiZVXEgRPUa_gWLzdUY,39,3,0,0,1,2,4,0,0,0,0,0,0,0,0,4,1,0,3,0,5,2,0,0,1,0,0,1,0,0,27,0.69
"Tullamore College, Riverside, Tullamore",Tullamore College,ChIJicEWR4WlXUgRy2QNizfHk2s,73,5,2,3,5,1,3,1,0,0,0,0,0,2,0,20,0,0,2,1,2,0,0,0,1,1,0,0,0,0,49,0.67
"Coláiste Choilm, Tulach Mhor",Coláiste Choilm,ChIJUWfgx46lXUgR_-vnbJUlvsI,112,6,2,6,10,10,9,1,0,0,0,0,1,5,0,11,1,0,8,1,1,0,0,0,0,0,0,2,0,0,74,0.66
"Oaklands Community College, Sr. Senan Avenue, Edenderry",Oaklands Community College,ChIJ_5lCQ7SaXUgRKIkF5YFicuA,82,2,1,2,0,10,2,0,0,0,0,1,0,1,2,12,0,0,5,0,5,3,0,0,0,3,0,0,0,0,49,0.6
"Mean Scoil Muire Gan Smal, Clochar na Trocaire, Roscomain",Scoil Muire gan Smal,ChIJ25b9X7I8XEgRrKE3KVekcqI,85,8,3,12,6,6,21,1,0,0,0,0,0,1,0,8,1,0,2,0,1,3,0,1,1,0,0,2,0,0,77,0.91
"Castlerea Community School, Castlerea",Castlerea Community School,ChIJodeSROsdXEgRbf-S_xcfiZA,71,1,1,4,7,1,12,1,0,0,0,0,0,2,0,6,0,0,17,0,2,5,0,1,0,0,0,1,0,0,61,0.86
"Scoil Mhuire, Clochar na Trocaire, Strokestown, Roscommon",Scoil Mhuire,ChIJI1FiqHkoXEgRcgBbYeAVCNc,71,3,0,5,2,4,8,2,1,0,0,0,0,9,0,1,0,0,9,0,2,9,0,0,2,0,1,0,1,0,59,0.83
"Elphin Community College, Elphin, Castlerea",Elphin Community College,ChIJIe8IebKdXkgR_Eq2qovFHYM,20,2,0,0,2,2,1,0,0,0,0,0,0,0,0,0,0,0,4,0,1,2,0,0,1,0,0,0,0,0,15,0.75
"CBS Roscommon, Abbeytown, Galway Road, Roscommon",Galway Road,ChIJjXb5P7A8XEgRerBwkYpgUSE,69,3,0,2,6,3,20,0,0,0,0,0,0,3,0,2,0,0,6,0,0,2,0,1,3,0,0,0,0,0,51,0.74
"Vocational School, Lisnamult, Roscommon",Roscommon Community College,ChIJEQeB27M8XEgRidM3Co458DQ,222,0,0,0,2,1,0,0,0,0,0,0,0,0,0,4,0,0,7,0,0,1,0,0,0,1,0,0,0,0,16,0.73
"Abbey Community College, Boyle",Abbey Community College,ChIJpwWuHf2ZXkgRcxexsmiAD58,78,4,1,3,1,3,10,0,2,0,0,1,0,2,1,1,0,1,6,1,1,6,0,2,1,0,0,0,0,0,47,0.6
"Summerhill College, College Road, Sligo",Summerhill College,ChIJLX1yXCC3XkgRy_bryj6Eu_E,138,17,3,10,6,9,24,2,0,1,0,0,0,3,0,0,0,0,5,2,0,58,1,1,0,0,0,0,0,0,142,1.03
"St Attracta’s Community School, Tubbercurry",St Attractas Community School,ChIJdfn9apS2XkgRUwWywjl7HBQ,103,8,3,4,17,9,9,0,0,0,0,0,0,0,0,1,0,1,10,0,0,18,0,3,1,1,5,0,0,1,91,0.88
"*Sligo Grammar School Ltd, The Mall, Sligo",Sligo Grammar School,ChIJs5ENR0roXkgR1pJCqqqV-wc,65,9,5,3,5,2,5,3,2,1,2,0,0,1,0,0,0,0,7,1,0,6,0,2,0,1,0,0,0,1,56,0.86
"Mercy College, Chapel Hill, Sligo",Mercy College,ChIJ33V7X7XpXkgRYy9pL31stis,46,4,1,6,1,4,4,0,0,0,0,0,0,1,0,0,0,0,3,0,0,10,0,3,1,0,1,0,0,0,39,0.85
"Coláiste Muire, Ballymote",Colaiste Muire,ChIJCR9EdgO_XkgRnBxpJcho8Mg,45,4,1,1,3,0,9,0,0,0,0,0,0,0,0,0,0,0,2,0,0,16,0,2,0,0,0,0,0,0,38,0.84
"Ursuline College, Finisklin, Sligo",Ursuline Convent,ChIJqRrrpi_oXkgRbnMkjEc7SRA,140,9,4,7,2,14,17,0,2,0,0,1,0,3,0,1,0,0,4,0,0,35,0,5,5,1,4,1,0,2,117,0.84
"Coláiste Iascaigh, Easkey",Colaiste Iascaigh,ChIJD-5iQKPSXkgRoreTxwMKy9E,23,1,0,1,1,0,3,0,0,0,0,0,0,0,0,1,0,0,4,0,0,5,0,0,1,0,0,2,0,0,19,0.83
"St. Mary’s College, Ballysadare",St Marys College,ChIJq3MEyfLBXkgRGrQcEqlYQXY,45,6,2,3,1,2,2,0,0,0,1,0,0,3,0,1,0,0,1,1,0,13,0,0,0,0,0,1,0,0,37,0.82
"Coola Post Primary School, Riverstown, via Boyle",Coola Post Primary School,ChIJQYdk0ieVXkgR6Xt6PSflG-0,73,9,0,6,0,6,9,0,1,0,1,0,0,0,0,1,0,0,0,0,1,19,0,3,0,0,3,0,0,0,59,0.81
"Jesus and Mary Secondary School, Pier Road, Enniscrone, Sligo",Jesus and Mary Secondary School,ChIJK8N3iXsxWUgR-tV2zi-25BE,45,1,0,3,1,3,8,0,0,0,0,0,0,0,0,0,0,0,7,0,0,6,0,1,2,0,0,0,0,0,32,0.71
"Corran College, Ballymote",Corran College,ChIJvVP5wwK_XkgR-Z16GgG6IPc,15,0,0,0,0,1,0,0,0,0,0,0,0,0,0,1,0,0,0,0,0,7,0,0,0,0,0,0,0,0,9,0.6
"Grange Vocational School, Grange, Sligo",Grange Post Primary School,ChIJAVjgeVLnXkgRLG4l7BUlKqg,33,0,1,0,0,0,2,0,0,0,0,0,0,0,0,0,0,0,0,0,0,12,0,2,0,0,0,1,0,0,18,0.55
"Ballinode Community College, Clarion Road, Sligo",Sligo College of Further Education,ChIJoUPqnU_oXkgRdHCchLVUYs0,28,0,0,0,0,0,1,0,0,0,0,0,0,0,0,0,0,0,7,0,0,7,0,0,0,0,0,0,0,0,15,0.54
"Coláiste Mhuire Co-Ed, Castlemeadows, Thurles",Colaiste Mhuire Co-Ed,ChIJdR9QX5TEXEgRKr3nlmjAoV8,12,0,0,0,1,0,1,0,0,0,0,0,0,0,0,2,0,0,1,0,0,0,0,0,3,5,0,1,0,0,14,1.17
"Clochar na Nursulach, Thurles",Ursuline Convent,ChIJN1XtNsfEXEgRuP7_BWQ0u9A,116,20,7,3,14,5,7,32,2,0,0,0,0,1,0,0,2,0,0,0,1,0,0,0,5,10,0,13,1,1,124,1.07
"St Mary’s Secondary School, Convent of Mercy, Nenagh",St Marys Secondary School,ChIJpcU6T1uRXEgRQo8aXSDjQi0,73,1,2,2,13,1,15,5,0,0,0,0,0,1,0,1,3,0,5,0,0,1,1,1,7,4,0,10,0,0,73,1
"*Cistercian College, Roscrea",Cistercian College Roscrea,ChIJ9T4Xc7L6XEgR3qYttKMbmtI,35,1,4,0,5,1,9,3,0,0,0,0,0,2,0,0,1,0,2,0,0,0,0,0,2,1,0,1,1,1,34,0.97
"St Joseph’s CBS Secondary School, Summerhill, Nenagh",St. Joseph's CBS,ChIJMauinFyRXEgR6mIumy8H_tY,65,3,2,0,14,1,5,1,0,0,0,1,0,0,0,1,1,0,2,0,0,1,1,0,12,5,0,10,0,0,60,0.92
"St. Joseph’s College, Borrisoleigh, Thurles",St. Joseph's College,ChIJU8Bbd7zBXEgRJK1mXhddItU,56,4,0,0,8,1,4,11,0,0,0,0,0,1,0,0,3,1,1,1,1,0,0,0,5,3,0,7,0,0,51,0.91
"Scoil Muire, Clochar na Trocaire, Newport, Tipperary N.R.",County Tipperary,ChIJX7R4YLfGXEgR0B2Y8azHABg,83,0,2,0,31,1,1,4,0,0,0,0,0,3,0,1,2,0,4,1,0,0,0,0,16,0,0,9,0,0,75,0.9
"Presentation Secondary School, Thurles",Presentation Secondary School Thurles,ChIJO3TVgcfEXEgRkxllIoEqDIA,101,6,8,6,12,1,3,14,0,0,0,1,0,1,0,1,4,1,1,0,2,0,4,0,6,9,0,9,0,0,89,0.88
"Borrisokane Community College, Borrisokane",Borrisokane Community College,ChIJP1zJ-sSMXEgRMaF-Jnd2ltk,76,1,2,0,16,2,8,1,1,0,0,0,0,0,0,3,1,0,1,1,0,0,0,0,20,0,0,1,0,0,58,0.76
"Our Lady’s Secondary School, An Teampall Mor",Our Lady's Secondary School,ChIJbTBt1gXoXEgRfX1wNS9o-xY,79,3,1,2,13,2,1,6,0,0,0,0,0,0,0,1,4,0,0,0,0,0,0,0,9,2,0,7,0,1,52,0.66
"Coláiste Phobal Ros Cré, Roscrea",Colaiste Phobail Ros Cre,ChIJZTgqFM_kXEgRpYsVGREdk7w,90,1,1,0,7,0,11,5,0,0,0,0,0,1,0,5,0,0,1,0,0,1,3,0,7,12,0,3,0,0,58,0.64
"Newport College, Black Road, Newport",Newport College,ChIJPQ0D2qShXEgRHbJQ3xdtPKQ,20,0,0,0,1,0,0,0,0,0,0,0,0,0,0,0,0,0,0,0,0,0,0,0,5,0,0,4,0,0,10,0.5
"Nenagh College, Dromin Road, Nenagh",Nenagh College,ChIJ0UvxNGiRXEgRhL-i6pwtWZY,51,0,0,0,4,0,0,0,0,0,0,0,0,0,0,0,0,0,2,0,1,1,0,1,9,5,0,2,0,0,25,0.49
"Clochar na Toirbhirte, Ballingarry, Thurles",Ballingarry,ChIJPb_5FyrWXEgRkNwxl6nHAAo,31,1,0,1,5,2,2,5,0,0,0,0,0,1,0,0,0,0,0,1,1,0,1,0,2,11,0,1,0,0,34,1.1
"*Rockwell College, Cashel",Rockwell College,ChIJ8X5SriHLXEgR9Wr9GvHBnQQ,100,15,9,3,7,3,6,17,0,1,0,0,0,7,0,0,14,0,0,0,4,1,3,0,3,2,0,3,0,1,99,0.99
"Scoil Mhuire, Greenhill, Carrick on Suir",Scoil Mhuire,ChIJmVoqWuTWQkgRGRGKxDqnejY,78,4,1,3,5,1,4,17,0,0,0,0,0,0,0,0,0,0,0,0,0,0,0,0,3,30,0,5,0,0,73,0.94
"Ard Scoil na mBraithre, Cluain Meala",Ard Scoil na mBraithre,ChIJa2KxRP0xQ0gRiX0OQnvawmc,111,2,0,1,10,0,6,17,0,0,0,1,0,0,0,0,18,0,0,0,4,0,0,0,4,28,0,6,0,0,97,0.87
"The Abbey School, Station Road, Tipperary Town",Abbey School,ChIJ03NhymWyXEgRXrDLw633-NY,71,0,3,0,17,1,1,5,0,0,0,0,0,0,0,0,13,0,1,0,0,0,0,0,11,6,0,3,0,0,61,0.86
"Loreto Secondary School, Clonmel",Loreto Convent Secondary School,ChIJ8xdyyBAuQ0gRfdB883g015E,83,1,2,4,13,0,6,16,0,0,0,0,0,1,0,1,7,0,0,0,2,0,0,0,2,12,0,3,0,0,70,0.84
"St Anne’s Secondary School, Convent of Mercy, Tipperary",St Annes Secondary School,ChIJhUBvxGmyXEgRnN7mMSWAncs,55,1,1,1,9,0,4,6,0,0,0,0,0,0,0,0,4,0,0,0,0,0,1,0,7,6,0,4,0,0,44,0.8
"Presentation Secondary School, Dungarvan Road, Clonmel",Presentation Secondary School,ChIJG76HNuYxQ0gR4UBXdmwvTbY,80,3,0,3,7,1,5,9,0,0,0,1,0,0,0,0,4,0,2,0,0,0,0,0,6,21,0,1,0,0,63,0.79
"Scoil na mBraithre, Carraig na Siuire",Carrick-On-Suir,ChIJHwUZlvzWQkgREOkxl6nHAAo,40,1,0,0,3,0,0,1,0,0,0,0,0,0,0,0,1,0,1,0,0,0,0,0,4,19,0,0,0,0,30,0.75
"Cashel Community School, Cashel",Cashel Community School,ChIJxSHRttzLXEgRZoKNwElWdbs,129,5,2,1,18,2,1,19,1,0,0,0,0,2,0,0,8,0,1,0,1,0,2,0,10,15,0,6,1,0,95,0.74
"Central Technical Institute, Raheen Road, Clonmel",CTI Clonmel,ChIJD9TYDB0uQ0gRlab_WeDBWz0,44,1,1,0,7,0,0,2,0,0,0,0,0,0,0,0,2,0,1,0,2,1,1,0,4,9,0,0,0,0,31,0.7
"Coláiste Dun Iascaigh, Cashel Road, Cahir",Colaiste Dun Iascaigh,ChIJFX2Bv441Q0gRLZi03ZFEgjk,101,2,0,1,9,0,2,13,0,0,0,0,0,0,0,1,12,0,1,0,4,1,1,0,7,17,0,0,0,0,71,0.7
"St. Ailbe’s School, Rosanna Road, Tipperary Town",Saint Ailbe's School,ChIJk1f_tWmyXEgRZ1vh0Cgc3U8,30,1,0,0,5,0,2,0,0,0,0,0,0,1,0,0,0,0,0,0,0,0,0,0,3,6,0,1,0,0,19,0.63
"Scoil Ruáin, Killenaule, Thurles",Scoil Ruain Vocational School,ChIJrcZW2FnoXEgR6j3q7-8DD30,62,2,0,0,7,0,0,1,0,0,0,0,0,0,0,0,4,0,2,0,0,0,1,0,4,10,0,2,0,0,33,0.53
"Comeragh College, Greenside, Carrick-on-Suir",Comeragh College,ChIJFZdRIfnWQkgRh49zKx8RUfA,38,0,0,0,2,0,0,0,0,0,0,0,0,0,0,0,1,0,0,0,1,0,1,0,0,14,0,0,0,0,19,0.5
"Patrician/Presentation Sec.Sc., Fethard, Clonmel",Patrician Presentation Secondary School,ChIJmfVk5cbSXEgRFMDYk-EmQAg,18,1,0,0,0,0,1,0,0,0,0,0,0,0,0,0,1,0,0,0,1,0,0,0,3,1,0,0,0,0,8,0.44
"Waterpark College, Park Road, Waterford",Waterpark,ChIJ648Ul5fGQkgRddQW8OsDcKw,43,3,2,2,5,0,0,1,0,0,0,2,0,3,0,0,2,0,0,0,0,0,0,0,1,28,0,0,0,0,49,1.14
"St Augustine’s College, Abbeyside, Dungarvan",St. Augustine's College,ChIJFxjZWGkYQ0gRlm6BCBDi_gU,100,5,1,3,6,1,11,21,0,0,0,0,0,0,0,0,19,0,1,0,2,0,2,0,1,25,0,3,0,0,101,1.01
"St Angela’s School, Ursuline Convent, Waterford",St Angela’s Ursuline Secondary School,ChIJow_TgB3EQkgRGKuWvnpfHNQ,119,11,4,4,6,7,3,18,1,0,0,0,0,2,0,0,4,0,0,0,3,0,0,0,0,52,0,4,1,0,120,1.01
"Coláiste na Maighdine, Presentation Secondary School, Cannon Street, Waterford 48",Presentation Secondary School,ChIJi21TfBjEQkgRt1N9lvp35zQ,0,0,0,2,3,1,0,3,0,0,0,0,0,0,1,0,0,0,0,0,0,0,0,0,1,33,0,0,0,0,44,0.92
"Ard Scoil na nDéise, Convent Road, Dungarvan",Árd Scoil Na nDeise,ChIJKajG3SYYQ0gRWwqxwo7zDZM,67,4,1,4,4,1,3,11,0,0,0,0,0,0,0,1,3,0,1,0,1,0,0,0,1,23,0,2,0,1,61,0.91
"Coláiste Chathail Naofa, Youghal Road, Dungarvan",Colaiste Chathail Naofa,ChIJT7eQ1Y4XQ0gR5ubk-pDcOtw,20,0,0,0,0,0,0,0,0,0,0,0,0,0,0,0,5,0,0,0,1,0,0,0,0,12,0,0,0,0,18,0.9
"Our Lady of Mercy Sec Sch, Ozanam St, Waterford City",Our Lady of Mercy Secondary School,ChIJ6c94VyTEQkgROwUJQxuP6hk,103,4,1,1,2,2,0,11,0,0,0,0,0,0,0,0,1,0,0,1,3,0,0,1,1,61,1,0,0,0,90,0.87
