name,official_school_name,place_id,Number who sat the Leaving Cert in June 2017,UCD,TCD,DCU,UL,Maynooth University,NUIG,UCC,St. Angela’s,QUB,Ulster University,Blanchardstown IT,National College of Ireland,DIT,Tallaght,Athlone IT,CIT,Dundalk,Galway-Mayo IT,IADT,IT Carlow,IT Sligo,IT Tralee,IT Letterkenny,IT Limerick,IT Waterford,Marino Institute of Education,Mary Immaculate,NCAD,RCSI,Total number (all years) who accepted 2016 CAO place,  Totalprogression (all years) to 
"St. Mary’s Knockbeg College, Knockbeg, Carlow",St Marys Knockbeg College,ChIJV5No3XRoXUgRvyMjnbCtfbA,64,12,2,5,7,8,3,1,0,0,0,0,0,1,1,1,0,0,1,2,12,0,0,0,0,3,0,0,0,0,59,0.92
"Gaelcholáiste Cheatharlach, Easca ",Gaelcholáiste Ceatharlach,ChIJY-pleFtdXUgR7ZJXuYLkJvk,48,5,4,11,1,6,3,0,0,0,0,0,0,1,0,0,0,0,0,0,7,0,1,0,0,2,0,0,0,0,41,0.85
"St. Mary’s Academy CBS, Railway Road, Carlow",St Marys Academy CBS,ChIJSWLWBg1fXUgRC07H05nHO3Q,89,5,2,5,1,8,8,0,0,0,0,0,2,2,0,1,0,0,0,0,30,1,0,0,1,9,0,0,1,0,76,0.85
"Borris Vocational School, Borris",Borris Vocational School,ChIJKUW6qWNOXUgRpBR759kEqi4,89,10,0,5,5,10,1,1,0,0,0,0,0,4,0,0,0,0,0,1,16,0,0,0,0,22,0,0,0,0,75,0.84
"St Leo’s College, Dublin Road, Carlow",St Leo's College,ChIJ85hjRVZdXUgRV2YR3YBxYmU,152,9,7,19,5,24,10,1,0,0,0,2,0,3,1,1,2,0,0,0,24,0,0,0,2,11,0,1,2,0,124,0.82
"Community School, The Mullawn, Tullow, Carlow",Tullow Community School,ChIJm2ZM2hNfXUgRt7UmIdmHVSE,98,5,2,4,1,9,3,1,0,0,0,0,0,1,1,2,0,0,2,1,37,0,0,0,2,7,0,0,1,0,79,0.81
"Presentation College, Carlow",Presentation College Carlow,ChIJ6WgzMVxdXUgRcI4AHqcQOXA,96,2,4,2,0,5,0,1,0,0,0,0,0,7,1,3,0,0,0,1,31,0,0,0,4,14,0,0,0,0,75,0.78
"Presentation De La Salle College, Muine Bheag",Presentation De La Salle College,ChIJG5WjYrpFXUgRQSKOC7JQPqE,68,3,2,7,3,5,0,1,0,0,0,0,0,2,0,0,1,0,0,0,23,0,0,0,0,6,0,0,0,0,53,0.78
"Coláiste Eoin, Hacketstown",Colaiste Eoin,ChIJ7WAf3SzzZ0gRA-sz1mDnRtc,36,2,0,6,0,0,2,0,0,0,0,0,0,1,0,0,0,0,0,0,15,0,0,0,0,1,0,0,0,0,27,0.75
"Muinebheag Vocational School, Muinebheag",Coláiste Aindriú Secondary School,ChIJaYKleqhFXUgR7p0Fk3ghhKI,12,0,0,0,0,1,0,0,0,0,0,0,0,0,0,0,0,0,0,0,4,0,0,0,0,1,0,0,0,0,6,0.5
"Carlow Vocational School, Carlow Inst. of Further Education, Kilkenny Road, Carlow",Carlow Institute of Further Education and Training,ChIJf7m-VLFCXUgRyTbp3lFBbpw,67,2,1,2,0,4,0,0,0,0,0,3,0,1,0,0,1,0,0,0,13,0,0,0,0,3,0,0,1,0,31,0.46
"St. Patrick’s College Cavan, Cullies, Cavan",St Patrick's College,ChIJdSs3Q98NXkgRIsvvtI7hLZI,92,10,1,15,2,7,9,0,0,0,0,0,1,17,0,2,0,0,5,0,0,8,0,1,0,0,2,0,0,1,81,0.88
"Coláiste Loreto, Loreto College, Cavan",Loreto College,ChIJyyK4v-kNXkgRGlmVpNeSZLo,126,13,5,15,3,22,19,1,1,1,2,2,1,4,0,1,0,4,5,0,0,7,0,1,0,0,1,0,1,0,109,0.87
"St Aidan’s Comprehensive School, Coothill",St Aidan's Comprehensive School,ChIJ5wwTwiQdXkgRGlX2tLQ7hNk,71,3,1,9,0,3,10,0,0,0,0,0,0,3,1,1,0,9,2,1,1,3,0,2,0,0,0,0,0,1,50,0.7
"Bailieborough Community School, Virginia Road, Bailieborough",Bailieborough Community School,ChIJjX5mAp2qYEgR2FjKHkqdXt0,106,2,3,5,2,13,3,1,1,0,0,2,1,5,1,4,0,18,5,0,0,4,1,1,0,1,1,0,0,0,74,0.7
"Virginia College, Virginia",Virginia College in Richmond,ChIJy15dHpISsYkR0qR72sr-93A,129,8,3,7,1,14,5,1,2,0,0,5,1,13,1,5,0,10,2,1,0,7,0,2,1,0,0,0,0,0,89,0.69
"*Royal School, College Street, Cavan",Royal School,ChIJWWwc8TEMXkgRC-bhBentKdk,31,2,3,3,0,1,1,0,0,1,0,0,0,3,0,0,0,5,0,1,0,0,0,0,0,0,0,0,0,0,20,0.65
"St. Clare’s College, Ballyjamesduff",St Clares College,ChIJwfpi5KviXUgRmyDCNWjpJ0c,79,4,1,4,2,7,8,0,0,0,0,1,0,5,2,2,1,3,1,1,1,1,0,5,0,0,0,0,0,0,49,0.62
"St. Bricin’s College, Railway Road, Belturbert",Saint Bricin's College,ChIJI2pY9nMTXkgRta2BtiEgegw,38,2,0,2,0,4,0,0,0,0,0,0,0,2,0,0,0,0,3,0,0,6,1,2,0,0,0,0,0,0,22,0.58
"Breifne College, Cootehill Road, Cavan",Breifne College,ChIJfQWGnXMOXkgRlNv8lcP0BHo,100,4,0,7,0,5,7,0,0,0,0,0,0,8,0,2,0,1,10,0,0,6,0,1,1,0,1,0,0,1,54,0.54
"St. Mogue’s College, Bawnboy, Belturbet",St Mogues College,ChIJ00Q8Us0NXkgR6U0m49nshvU,28,0,2,3,0,2,2,0,0,0,0,0,0,3,0,1,0,0,1,0,0,0,0,0,0,0,0,0,0,0,14,0.5
"Kilkee Community School, Carrigaholt Road, Kilkee",Kilkee Community College,ChIJQU9N1RToWkgR9sdB9mTIlQ4,21,0,0,0,0,2,3,1,0,0,0,0,0,0,0,2,0,0,2,0,1,0,4,0,7,0,0,2,0,0,24,1.14
"Rice College, Christian Brothers, New Road, Ennis",Rice College Secondary School,ChIJE74IJTJtW0gROJW0V1uuTyk,100,4,3,1,24,0,19,5,0,0,0,0,0,2,0,2,1,0,11,0,0,0,5,2,15,1,0,7,0,0,102,1.02
"Kilrush Community School, Kilrush",Kilrush Community School,ChIJMc2ktXPeWkgRFZXRr1WlZgI,45,1,2,0,10,0,8,1,0,0,0,0,0,0,0,1,1,0,7,0,0,0,2,1,9,2,0,0,0,0,45,1
"Mean Scoil na mBraithre, C.B.S., Ennistymon","CBS Secondary School, Ennistymon",ChIJF-4VLnYGW0gR8I7iv139Lus,21,0,0,0,10,0,3,0,0,0,0,0,0,0,0,0,1,0,3,0,0,0,0,0,3,0,0,0,0,0,20,0.95
"Kilmihil Community College, Kilmihil",St Michaels Community College,ChIJy7F20t8eW0gR8-WLUxW203c,33,0,0,0,5,0,10,1,0,0,0,0,0,0,0,5,0,0,3,0,1,1,2,0,3,0,0,0,0,0,31,0.94
"Coláiste Muire, College Rd, Ennis",Colaiste Muire,ChIJN2CxzDJtW0gRs8iY5vyknOY,118,8,4,3,19,1,20,14,0,0,0,0,0,0,0,1,4,0,5,0,1,2,5,1,11,2,0,9,0,0,110,0.93
"Coláiste Fhlannain, Inis",Saint Flannans College,ChIJhcP07CoTW0gRYn-qvBOt_LM,215,2,4,6,51,2,37,18,0,0,0,0,0,1,0,2,2,0,25,0,0,0,3,2,23,2,0,14,1,0,195,0.91
"St Anne’s Community College, Killaloe",Saint Anne's Community College,ChIJmagn7_GeXEgRJ4XoYK-9d0g,83,2,2,5,20,1,7,10,0,0,0,0,0,0,0,0,0,0,5,0,2,0,0,0,14,0,0,6,0,0,74,0.89
"Scoil Ioseph, An Tulach, Inis",Cannot find the name,No Data,85,0,0,0,16,0,10,6,0,0,0,0,0,1,0,2,3,0,10,1,0,1,2,1,8,2,0,7,0,0,70,0.82
"Mary Immaculate Secondary School, Liosduin Bhearna, Inis",Mary Immaculate Secondary School,ChIJA85kqwOoW0gRMhkQbE84rFs,30,0,0,0,4,0,2,3,0,0,0,0,0,0,0,0,3,0,7,0,0,0,0,0,4,0,0,0,0,0,23,0.77
"Ennis Community College, Harmony Row, Ennis",Ennis Community College,ChIJn9fOCM0SW0gRSMqTtM7CrF4,39,1,0,0,8,0,7,2,0,0,0,0,0,0,0,1,1,0,2,0,0,0,0,0,3,0,0,4,0,0,29,0.74
"St Caimin’s Community School, Tullyvarraga, Shannon",St Caimin's Community School,ChIJx_KVGNtBW0gRZ3z4gIaUszM,117,0,0,0,22,1,13,3,0,0,0,0,0,1,0,2,0,0,5,0,0,0,4,0,24,0,0,10,0,0,85,0.73
"Scariff Community College, Scariff",Community College Hall,ChIJAWuL_ladXEgRheuAp5iR13o,64,2,0,0,7,0,4,1,0,0,0,0,0,0,0,2,0,0,6,1,2,0,2,0,8,3,0,8,0,0,46,0.72
"Ennistymon Vocational School, Ennistymon","Scoil Mhainchín, Ennistymon National School",ChIJD0L4-NcFW0gRhZLPNT3u-eI,20,0,0,0,1,0,2,1,0,0,0,0,0,0,0,0,1,0,2,0,0,1,0,0,4,1,0,1,0,0,14,0.7
"St John Bosco Community College, Kildysart, Ennis",St John Bosco Community College,ChIJIf9CsSc9W0gRv6-AN9fts1E,25,1,0,0,6,0,3,1,0,0,0,0,0,0,0,0,0,0,0,0,0,0,0,0,5,0,0,0,0,0,16,0.64
"Scoil Sheosaimh, Rinn na Spainneach, Sraid na Cathrach, Inis",Spanish Point,ChIJg5nahbICW0gRgCIyl6nHAAo,35,0,0,0,8,1,2,0,0,0,0,0,0,0,0,1,0,0,1,0,0,0,4,0,1,0,0,1,0,0,19,0.54
"St Patrick’s Comprehensive Sch, Shannon",St Patricks Comprehensive School,ChIJlWlXStZBW0gRiLVYWfYb1mA,97,0,1,0,12,0,2,1,0,0,0,0,0,0,0,0,0,0,7,0,1,0,2,0,19,0,0,2,0,0,47,0.48
"*Presentation College, Mardyke, Cork City",Presentation Brothers College,ChIJj8U0XT2QREgRfNm-mCxmupo,99,5,5,1,2,0,2,80,0,0,0,0,0,0,0,0,18,0,1,0,1,0,0,0,0,0,0,1,0,0,116,1.17
"St Aloysius School, St Maries of The Isle, Sharmon, Crawford Street","St Aloysius School, Cork",ChIJufuuOxiQREgRy9DH2QmNkA0,41,0,0,0,0,0,1,26,0,0,0,0,0,1,0,0,17,0,0,0,0,0,1,0,1,0,0,1,0,0,48,1.17
"*Christian Brothers College, Sidney Hill,, Wellington Road, Cork",Christian Brother's College Cork,ChIJ48s9NwyQREgR5D2yJD2iYa4,143,4,4,0,7,0,2,124,0,0,0,0,0,0,0,0,16,0,0,1,0,0,2,0,2,0,0,1,0,0,163,1.14
"Scoil Mhuire, Beal Athan Ghaorthaidh",Scoil Mhuire,ChIJf8d05l0bRUgR0TefNrXeW8Q,18,2,0,0,3,0,0,6,0,0,0,0,0,0,0,0,7,0,0,0,0,0,0,0,0,0,0,2,0,0,20,1.11
"St Mary’s Secondary School, Macroom",St. Mary's Secondary School,ChIJPb9-6EHlREgRaiRT4Cfv8VM,49,2,0,0,3,0,1,24,0,0,0,0,0,1,0,0,13,1,0,0,0,0,2,0,0,3,0,4,0,0,54,1.1
"Coláiste an Phiarsaigh, Gleann Maghair, Cathair Chorcai",Coláiste an Phiarsaigh,ChIJY0rVWBmbREgRsQtdmJHny3w,66,1,2,0,7,0,2,38,0,0,0,0,0,0,0,0,15,0,1,1,0,0,0,0,0,1,0,4,0,0,72,1.09
"Gaelcholáiste Mhuire (A.G), An Mhainistir Thuaidh, Corcaigh","Gaelcholáiste Mhuire, A.G. North Monastery",ChIJmY1vhGyQREgR1KOmSxI6zIk,59,0,0,0,0,0,0,35,0,0,0,0,0,0,0,0,28,0,0,0,0,0,0,0,0,0,0,0,0,0,63,1.07
"St Mary’s Secondary School, Convent of Mercy, Mallow",St Mary's Secondary School,ChIJhxXdiFC5REgR89j1PjVFgtg,80,3,3,0,10,1,4,30,0,0,0,0,0,1,0,0,13,0,0,0,3,0,5,0,2,3,0,7,0,0,85,1.06
"Presentation Secondary School, Mitchelstown, Mallow",Presentation Secondary School,ChIJbayy6hRXQ0gRUkAuZimnbDs,35,2,1,1,4,0,0,16,0,0,0,0,0,0,0,1,3,0,0,0,0,0,0,0,2,2,0,5,0,0,37,1.06
"Mount Mercy College, Model Farm Road, Cork",Mount Mercy College,ChIJBzRSF_CRREgRSEHlwVm4XKQ,98,1,2,1,0,0,3,71,0,0,0,0,0,0,0,0,16,0,1,0,1,0,0,0,0,1,0,4,0,0,101,1.03
"Coláiste De La Salle, Macroom",De La Salle College,ChIJ8znsQrLlREgRCC0RilUhCp0,37,0,0,0,4,0,0,14,0,0,0,0,0,0,0,0,17,0,0,0,0,0,1,1,1,0,0,0,0,0,38,1.03
"Regina Mundi College, Douglas Road, Cork City",Regina Mundi College,ChIJT3FD51OFREgRSM6MGK-bZYc,76,2,1,0,0,0,0,49,0,0,0,0,0,0,0,0,19,0,0,0,0,0,0,0,2,1,0,4,0,0,78,1.03
"Ashton Comprehensive School, Blackrock Road, Cork City",Ashton Comprehensive School,ChIJq60xs7aaREgRsS6Qx-q1QRY,71,3,1,0,6,0,0,36,0,0,0,0,0,0,0,0,23,0,2,0,0,0,0,0,0,1,0,0,0,0,72,1.01
"*Scoil Mhuire, 1/2/3 Sidney Place, Wellington Road, Cork City",Scoil Mhuire Junior School,ChIJt61qmw6QREgRbzobu0rl5uo,64,3,5,0,0,0,1,46,0,0,0,0,0,0,0,0,7,0,0,0,0,0,0,0,0,0,0,2,0,0,64,1
"Hamilton High School, Laurel Walk, Bandon",Hamilton High School,ChIJs6HMUCj0REgRqBF7KlQdZvI,52,3,0,0,3,0,0,22,0,0,0,0,0,0,0,0,17,0,0,0,1,0,0,0,2,1,0,2,0,0,51,0.98
"Sacred Heart Secondary School, Clonakilty",Sacred Heart Secondary School Clonakilty,ChIJ7xZKUOFWREgRWGdxwxo95Vk,70,3,0,2,6,0,2,23,0,1,0,1,0,1,0,0,17,0,0,1,0,0,2,0,0,4,0,3,0,2,68,0.97
"Mount St Michael’s, Rosscarbery",Mount Saint Michael's Secondary School,ChIJM9lUOFNTREgRBu1XPMF6BT0,61,5,1,0,7,0,1,24,2,0,0,0,0,1,0,0,11,0,1,0,0,0,1,0,0,2,0,3,0,0,59,0.97
"Coláiste na Toirbhirte, Ard Aoibhinn, Bandon",Coláiste na Toirbhirte (Presentation College),ChIJ57gofzfxREgR3Qa6ey4ooPs,91,3,0,0,8,0,2,40,0,0,0,0,0,2,0,1,19,0,0,0,0,0,1,0,1,2,0,9,0,0,88,0.97
"Coláiste Mhuire, Realt na Mara, Crosshaven, Corcaigh",Colaiste Muire Crosshaven,ChIJV8ba-kSBREgRiTj4UH24UF8,75,2,1,1,1,0,1,34,1,0,0,0,0,0,0,0,28,0,0,0,2,0,0,0,0,0,0,1,0,0,72,0.96
"Coláiste Choilm, Ballincollig",Colaiste Choilm,ChIJvzR5oHKSREgRpkwEt-UtHYI,207,0,0,0,4,1,1,109,0,1,0,0,0,0,0,1,71,0,0,1,1,0,1,0,2,3,0,1,0,1,198,0.96
"St Francis Capuchin College, Rochestown, Cork City",St Francis Capuchin College,ChIJ_____yKFREgRgKZ_COyXejY,111,1,1,0,1,0,1,72,0,0,0,0,0,1,0,0,25,0,0,0,0,0,0,0,0,1,0,3,0,0,106,0.95
"Scoil Phobail Bhéara, Castletownbere, Co.Cork",Scoil Phobail Bheara,ChIJE1u-j0x-RUgRjjtvK4EBfQo,43,0,0,0,1,0,0,16,0,0,0,0,0,0,0,0,16,0,0,0,2,0,1,0,1,0,0,3,0,0,40,0.93
"Patrician Academy, Mallow",Patrician Academy,ChIJ4YP25le5REgRw5ouctqSSWo,53,2,0,0,7,0,0,18,0,0,0,0,0,0,0,0,16,0,0,0,1,0,1,0,0,3,0,1,0,0,49,0.92
"Coláiste an Spioraid Naoimh, Bishopstown, Cork",Coláiste an Spioraid Naoimh,ChIJ9f4d2CmOREgR-jvVpdLinTo,113,1,1,0,2,0,1,60,0,0,0,0,0,0,0,0,36,1,0,0,0,0,0,0,0,0,0,1,0,0,103,0.91
"Ursuline Secondary School, Blackrock, Cork",Ursuline Girls Secondary School,ChIJPW1Ddc6aREgRUkzMekpR5s0,21,1,0,0,0,0,0,10,0,0,0,0,0,0,0,0,7,0,0,0,0,0,0,0,0,1,0,0,0,0,19,0.9
"St Angela’s College, Griffith College Campus, Wellington Road, Cork",Griffith College Cork,ChIJCWDYRRqQREgRkeytSe-9zGo,84,1,2,0,0,0,1,53,0,0,0,0,0,0,0,0,13,0,1,0,0,0,0,0,1,0,0,4,0,0,76,0.9
"Clonakilty Community College, Clonakilty",Clonakilty Community College,ChIJR0et1udWREgRm2TWVxj4D0U,97,2,4,1,7,0,3,27,0,0,0,0,0,1,0,0,25,0,0,0,1,0,3,0,1,11,0,1,0,0,87,0.9
"Clochar na Trocaire, Sciobairin",Skibbereen,ChIJrRxn7rilRUgR-z8cNRaz2ig,60,0,1,0,5,0,2,20,0,0,0,0,0,2,0,0,14,2,1,0,1,0,1,0,1,2,0,1,0,0,53,0.88
"Scoil Mhuire, Clochar na Trocaire, Ceann Toirc, Mala Co Chorcai",Scoil Mhuire Na Trocaire,ChIJ3cZw_bSwREgRAmia36KPuh4,66,2,1,0,7,0,3,9,0,0,0,0,1,0,0,0,16,0,1,0,3,0,6,0,2,1,1,5,0,0,58,0.88
"St Fachtna’s High School, North Street, Skibbereen",St Fachtnas De La Salle College,ChIJOa7VXJWlRUgRjw6vPLRrMBA,48,2,2,0,4,0,1,12,0,0,0,0,0,0,0,0,19,0,0,0,0,0,0,0,1,1,0,0,0,0,42,0.88
"St Mary’s High School, Castleredmond, Midleton",St. Mary's High School,ChIJjTtvNi1jQ0gRDsg_zVnxflU,104,5,0,0,6,0,2,47,0,0,0,0,0,0,0,0,18,0,0,0,0,0,0,0,0,8,0,5,0,0,91,0.88
"Christ The King Sec School, Half Moon Lane, South Douglas Road, Cork",Christ King Girls Secondary School,ChIJ2YB9S_yPREgRIStAVE5_fdM,149,1,1,1,2,0,5,75,0,0,0,0,0,1,0,0,32,1,0,0,1,0,1,0,2,1,0,4,0,0,128,0.86
"Community School, Innishmore, Ballincollig",Ballincollig Community School,ChIJO_idY26SREgRL0Qsow9CdYo,105,0,0,1,2,0,1,51,1,0,0,0,0,2,1,0,28,0,0,1,0,0,0,0,0,1,0,1,0,0,90,0.86
"St Aloysius College, Carrigtwohill, Cork",St Aloysius College,ChIJ5fJKwUidREgRclnLei-f5zs,122,2,2,0,4,0,0,64,0,0,0,0,0,2,0,0,22,0,0,0,0,0,0,0,1,3,1,2,0,0,103,0.84
"Carrigaline Community School, Waterpark Road, Carrigaline, Cork",Carrigaline Community School,ChIJc5ycxsqFREgRQNjCQDXFlGw,148,2,1,1,2,0,1,50,0,0,0,0,0,0,0,1,61,0,0,0,1,0,0,0,2,1,0,1,0,0,124,0.84
"Coláiste Ghobnatan, Baile Bhuirne, Maigh Cromtha",Ballyvourney,ChIJfZqCBTweRUgRETq7GajHACY,42,1,0,0,7,0,1,9,0,0,0,0,0,0,0,0,8,0,0,0,0,0,1,0,1,0,0,7,0,0,35,0.83
"Coláiste Daibhéid, Teach Buckingham, Sraid an Mhuilinn na Sabhadoirea, Corcaigh",Coláiste Daibhéid,ChIJeZEC7gSQREgRrDJCAzj8lPs,42,0,0,0,0,0,1,22,0,0,0,0,0,0,0,0,11,1,0,0,0,0,0,0,0,0,0,0,0,0,35,0.83
"Loreto Secondary School, Fermoy",Loreto Secondary School,ChIJjXHcAj9fQ0gRxPqrfEZ-qag,116,4,2,2,11,0,2,36,0,0,0,0,0,0,1,0,10,0,0,0,2,0,1,0,1,12,0,12,0,0,96,0.83
"Coláiste an Chroi Naofa, Carraig na Bhfear, Corcaigh",Colaiste An Chroi Naofa,ChIJI6rYNOeZREgRsO1Jj7pNEGY,74,1,0,0,1,0,0,19,0,0,0,0,0,0,0,1,37,0,0,0,0,0,1,0,0,0,0,1,0,0,61,0.82
"Coláiste Treasa, Kanturk, Mallow",Colaiste Treasa,ChIJfcd6tevFREgRIlSqh6W7Ypo,88,2,1,0,12,0,4,9,0,0,0,0,0,0,0,2,25,0,1,0,1,0,2,0,3,4,0,5,0,1,72,0.82
"Douglas Community School, Douglas Road, Cork City",Douglas Community School,ChIJP5P5uVCFREgRX6_NnP1UZHg,82,0,0,0,0,0,0,29,0,0,0,0,0,0,0,0,37,0,0,0,0,0,0,0,0,1,0,0,0,0,67,0.82
"Boherbue Comprehensive School, Boherbue, Mallow",Boherbue Comprehensive School,ChIJL6Zg30LaREgRtlrLkLZaKGA,89,1,0,0,15,0,1,14,0,0,0,0,0,0,0,0,11,0,2,0,0,0,5,0,1,2,0,3,0,1,56,0.81
"Millstreet Community School, Millstreet Town, Co.Cork ",Millstreet Community School,ChIJc4l_sCncREgREysRMu6falg,41,0,0,0,5,0,2,10,0,0,0,0,0,0,0,0,12,1,0,0,0,0,1,0,0,1,0,1,0,0,33,0.8
"Maria Immaculata Comm. College, Dunmanway",Maria Immaculata Community College,ChIJ6_5aWK4BRUgRISmyKnPEGro,61,0,0,1,6,0,1,16,0,0,0,0,0,0,0,0,17,0,1,0,0,0,3,0,1,1,0,1,0,0,48,0.79
"Pobailscoil na Trionóide, Parkmountain, Youghal",Pobalscoil Na Tríonóide,ChIJwyAZ5qJtQ0gRi0jF676agl8,139,1,1,1,11,0,2,40,0,0,0,0,0,0,0,0,31,0,0,0,1,0,1,0,1,17,0,1,1,0,109,0.78
"Schull Community College, Colla Road, Schull",Schull Community College,ChIJUe_ZFG-ZRUgRrU6PefBhAJs,74,1,4,2,4,0,4,10,0,0,0,0,0,1,0,0,20,1,0,2,1,1,0,0,1,6,0,0,0,0,58,0.78
"Coláiste Pobail Naomh Mhuire, Cill na Mullach",Coláiste Pobail Noamh Mhuire,ChIJ3cZw_bSwREgRknldXY56kao,36,0,0,0,6,1,1,7,0,0,0,0,0,0,0,0,7,0,1,0,1,0,1,0,2,0,0,1,0,0,28,0.78
"Coachford Community College, Coachford",Coachford Community College,ChIJ0bT9nynsREgR0RPzQpXjR2w,107,1,0,0,1,0,0,27,0,0,0,0,0,0,0,0,45,1,1,0,0,0,2,0,0,1,0,4,0,0,83,0.78
"Christian Brothers Secondary School, Bakers Road, Charleville",Charleville Christian Brother's School,ChIJAax5VBKzREgREg0pB1xkTfA,53,0,1,0,12,0,2,8,0,0,0,0,0,0,0,0,7,0,0,0,1,0,2,0,5,0,0,3,0,0,41,0.77
"Christian Brothers Secondary School, Mitchelstown",CBS Mitchelstown,ChIJq3SICBNXQ0gRI-OtTrTFDWI,52,1,0,0,12,0,1,12,0,0,0,0,0,0,0,0,7,0,0,0,1,0,0,0,1,3,0,2,0,0,40,0.77
"Kinsale Community School, Kinsale",Kinsale Community School,ChIJUwLageZhREgR4rbGmZiOVU4,120,0,3,0,4,1,1,34,0,0,0,0,0,2,0,0,37,0,2,2,0,0,0,0,1,3,0,2,0,0,92,0.77
"Coláiste Chríost Rí, Bothar Ceapmhaoil, Cathair Chorcai",Colaiste Chriost Ri,ChIJ6exE8wKQREgRt6SP8REj7Z4,110,2,1,0,1,0,0,43,0,0,0,0,0,0,0,0,37,0,0,0,0,0,0,0,0,0,0,0,0,0,84,0.76
"*Midleton College, Connolly Street, Midleton",Midleton College,ChIJnXiGRy5jQ0gRKVIyBTydaGs,67,3,1,1,2,0,5,17,0,0,0,0,0,2,0,0,17,0,1,0,0,0,0,0,0,0,0,2,0,0,51,0.76
"Christian Brothers School, Rosary Place, Midleton",Midleton Christian Brother's School Primary School,ChIJF16eOi1jQ0gRur2RQWSyUl0,91,1,2,0,6,0,3,22,0,0,0,0,0,0,0,1,26,1,1,0,0,0,2,1,0,3,0,0,0,0,69,0.76
"Coláiste Cholmain, Mainistir Fhear Muighe",St Colmans College,ChIJjXHcAj9fQ0gRTMIMfsxjtc0,69,0,1,0,2,0,3,19,0,0,0,0,0,0,0,2,24,0,0,0,1,0,0,0,0,0,0,0,0,0,52,0.75
"*Bandon Grammar School, Bandon",Bandon Grammar School,ChIJ6Vm4FS70REgRphK181IGUmM,100,6,8,3,5,0,4,19,0,0,0,0,0,1,0,0,20,0,0,0,0,1,3,0,1,0,0,2,0,1,74,0.74
"Coláiste Muire, Bishop Street, Cobh",Colaiste Muire,ChIJYy3qtKeDREgRt94Tm9ae-kI,95,1,1,0,2,0,0,21,0,0,0,0,0,0,0,0,37,0,0,1,1,0,0,0,2,2,0,2,0,0,70,0.74
"Glanmire Community College, Brooklodge, Glanmire",Glanmire Community College,ChIJDYUNRAubREgR55LNY4sRfqA,143,1,1,0,2,1,0,36,0,0,0,0,0,0,0,0,59,0,0,0,0,0,0,0,1,1,0,1,0,0,103,0.72
"Coláiste an Chraoibhin, Duntaheen, Fermoy",Coláiste an Chraoibhin,ChIJn7kMEUJfQ0gRiDgXO7ufkf8,77,0,0,0,5,0,0,18,1,0,0,0,0,0,0,0,18,0,1,0,3,0,1,0,1,4,0,3,0,0,55,0.71
"Coláiste Pobail Bheanntraí, Seskin, Bantry",Coláiste Pobail Bheanntraí - Bantry Community College,ChIJGd4IeFcKRUgRD9nhVlCXsqk,119,0,0,1,4,2,0,32,0,0,0,0,0,0,0,1,32,0,2,0,1,0,3,0,2,2,0,2,1,0,85,0.71
"Scoil Mhuire Gan Smal, Blarney",Scoil Mhuire Gan Smal,ChIJZZnM6XGRREgRFrKrUTBy5IA,100,1,0,0,2,0,0,19,0,0,0,0,0,0,0,0,40,0,0,0,1,0,1,0,0,2,0,2,0,0,68,0.68
"Gairm Scoil Bhrogain Naofa, Droichead na Banndan",Gaelscoil Droichead Na Banndan,ChIJFzoLEy30REgR0Sr4rRAd9ic,53,0,0,0,0,0,1,7,0,0,0,0,0,0,0,0,23,0,0,0,2,0,1,0,1,0,0,1,0,0,36,0.68
"Presentation Sec School, Joe Murphy Road, Ballyphehane, Cork City",Presentation Secondary School,ChIJpfUlXeCPREgR4mofbNILz9Q,36,0,0,0,0,0,0,11,0,0,0,0,0,0,0,0,11,0,0,0,1,0,0,0,0,0,0,1,0,0,24,0.67
"Nagle Rice Secondary School, Doneraile, Mallow",Nagle Rice Secondary School,ChIJ5VGaJp-6REgRtIg_Y9ClKH8,38,0,0,0,5,0,1,3,0,0,0,0,0,0,0,0,6,0,0,0,1,0,1,0,5,1,0,2,0,0,25,0.66
"Nagle Community College, Avenue De Rennes, Mahon, Cork",Nagle Community College,ChIJ2bCwLCuFREgRNDBhVALZTwo,22,0,0,0,0,0,0,4,0,0,0,0,0,0,0,0,9,0,0,0,0,0,0,0,1,0,0,0,0,0,14,0.64
"Cork College of Commerce, Morrisons Island, Cork ",Cork College of Commerce,ChIJ1Qj7lIKXREgRIFRTYhy7zr0,116,2,1,1,5,0,0,33,0,0,0,0,0,0,0,0,27,0,0,0,1,0,0,0,0,0,0,0,0,0,70,0.6
"Carrignafoy Community College, Cobh",Carrignafoy Community College,ChIJKzm8mgeDREgR8gba2lA9Hmg,15,0,0,0,0,0,0,4,0,0,0,0,0,0,0,0,4,0,0,0,0,0,0,1,0,0,0,0,0,0,9,0.6
"St. Fanahan’s College, Mitchelstown",St Fanahans College,ChIJq3SICBNXQ0gRrJrrqUBghE0,16,0,0,0,2,0,0,0,0,0,0,0,0,1,0,0,4,0,0,0,1,0,0,0,0,1,0,0,0,0,9,0.56
"North Presentation Sec. School, Farranree, Cork",North Presentation Secondary School,ChIJQQkGgGmQREgRPhZThhIRwuo,15,1,0,0,1,0,0,1,0,0,0,0,0,0,0,1,4,0,0,0,0,0,0,0,0,0,0,0,0,0,8,0.53
"Mayfield Community School, Old Youghal Road, Mayfield, Cork City",Mayfield Community School,ChIJuzmVipaaREgRe7OHDk8NSQs,33,0,0,0,1,0,0,8,0,0,0,0,0,0,0,0,5,1,0,0,0,0,0,0,0,0,0,0,0,0,15,0.45
"Rossa College, Skibbereen",Rossa College,ChIJNdwqX-ylRUgRAFTgH-MbgRI,20,0,0,0,1,0,0,2,0,0,0,0,0,0,0,0,5,0,0,0,0,0,0,0,1,0,0,0,0,0,9,0.45
"St Peter’s Community School, Passage West, Cork",St Peters Community School,ChIJcUCizGGDREgRZD3g6MWvb4E,56,0,0,0,1,0,1,11,0,0,0,0,0,0,0,1,7,0,0,0,0,0,0,0,1,1,0,2,0,0,25,0.45
"An Mhainistir Thuaidh, North Monastery Secondary School, North Monastery Road, Cork",North Monastery Secondary School,ChIJOdjfr2yQREgR2b2a9Zn7n2o,54,0,0,0,0,0,0,9,0,0,0,0,0,0,0,0,13,0,0,0,0,0,1,0,0,0,0,0,0,0,23,0.43
"St. Colman’s Community College, Midleton",St. Colmans Community College,ChIJUSlLjzJjQ0gRfTBRom0dNgY,82,0,0,0,0,0,1,9,0,0,0,0,0,0,0,0,18,0,1,0,0,0,0,0,0,4,0,0,0,0,33,0.4
"Bishop McEgan College, Macroom",Bishop McEgan College,ChIJ8znsQrLlREgRBbwcFDD9gaQ,24,0,0,0,1,0,0,1,0,0,0,0,0,0,0,0,5,0,0,0,0,0,1,0,0,1,0,0,0,0,9,0.38
"St Aidan’s Community College, Dublin Hill, Ballincollie Road",St Aidans Community College,ChIJv2iEkYKaREgRWEXAkl5QBvQ,75,0,0,1,0,0,0,8,0,0,0,0,0,0,0,0,16,0,0,0,0,0,0,0,2,1,0,0,0,0,28,0.37
"Deerpark C.B.S., St. Patrick’s Road, Cork",Deerpark C.B.S.,ChIJ50sGMByQREgRrMWWXktMoNg,31,0,0,0,0,0,0,1,0,0,0,0,0,0,0,0,9,0,0,0,0,0,0,0,1,0,0,0,0,0,11,0.35
"St Patrick’s College, Gardiner’s Hill, Cork",St Patricks College,ChIJu1Xi3KGaREgRtDhNAt0BsWU,49,0,0,0,0,0,0,11,0,0,0,0,0,0,0,0,5,0,0,0,0,0,1,0,0,0,0,0,0,0,17,0.35
"St Vincent’s Secondary School, St Mary’s Road, Cork City",St Vincents Secondary School,ChIJbZKVXBOQREgRz30L6g18JoA,44,0,0,0,0,0,0,4,0,0,0,0,0,0,0,0,9,0,1,0,0,0,0,0,0,1,0,0,0,0,15,0.34
"Bishopstown Community School, Westgate Road, Bishopstown, Cork",Bishopstown Community School,ChIJG0ve9diRREgRahZ4yC8dJ2c,21,0,0,0,0,0,0,2,0,0,0,0,0,0,0,0,5,0,0,0,0,0,0,0,0,0,0,0,0,0,7,0.33
"Davis College, Summerhill, Mallow",Gaelscoil Thomáis Dáibhís,ChIJqUD3Mqq-REgRavTHt__QDqY,110,1,0,2,8,0,2,18,0,0,0,0,0,0,0,0,25,0,0,0,0,0,1,0,3,0,0,0,0,0,60,0.55
"Terence Mcswiney, Community College, Knocknaheeny, Cork City",CityNorth College of Further Education,ChIJfVXvyjeQREgRGvrfFnv8nwM,13,0,0,0,0,0,0,0,0,0,0,0,0,0,0,0,1,0,0,0,0,0,0,0,0,0,0,0,0,0,1,0.08
"Coláiste na Carraige, An Charraig, Dun na Ngall",Coláiste na Carraige,ChIJ4zrSSlI9X0gRlaybgy5BVFQ,38,2,5,2,1,2,3,0,0,0,2,0,0,0,0,0,0,0,4,0,0,4,2,11,0,0,2,0,0,0,40,1.05
"Abbey Vocational School, Donegal Town",Abbey Vocational School Donegal Town,ChIJM2gLqzOoX0gRXXGIGbaqi8U,112,5,1,13,7,6,9,0,1,1,1,0,0,7,0,0,0,0,5,3,0,31,1,17,0,0,0,1,0,0,109,0.97
"Loreto Community School, Milford",Loreto Community School,ChIJReYuQGHyX0gREmB5CQmF1cc,134,11,0,11,2,10,6,1,2,1,0,1,1,3,0,2,0,1,2,0,1,8,1,60,0,0,0,1,0,0,125,0.93
"Magh Éne College, Church Road, Bundoran",Magh Ene College,ChIJmyv-zBP9XkgR3mLnYLjrBl0,49,2,0,4,0,3,4,0,1,0,0,0,0,0,0,1,0,0,6,0,0,18,0,6,0,0,0,0,0,0,45,0.92
"St Columbas College, Stranorlar, Lifford",St Columba's College,ChIJmxkZb8y-X0gR_DNUA_fahAM,161,7,2,5,1,8,21,1,0,1,4,0,1,2,0,0,0,0,3,0,0,9,0,70,1,0,6,0,0,0,142,0.88
"Pobalscoil Ghaoth Dobhair, Doirí Beaga, Leitir Ceanainn, Tír Chonaill",Derrybeg,ChIJu3xWM2B4X0gRwKYxl6nHAAo,59,3,1,7,2,7,9,1,0,1,1,0,0,2,1,0,0,0,5,0,0,1,0,9,0,0,0,0,0,0,50,0.85
"Coláiste Ailigh, Cnoc na Móna, Leitir Ceanainn",Colaiste Ailigh,ChIJbzwbn0jrX0gRoDqzZOQTdDI,32,2,0,3,1,0,3,0,0,0,1,0,0,2,0,1,0,0,1,1,0,2,0,10,0,0,0,0,0,0,27,0.84
"Clochar Loreto, Leitirceanainn",Loreto Convent,ChIJ-wGLOMyUX0gRLNBC-RwGIPU,153,7,4,8,2,15,21,2,1,5,5,0,1,3,0,0,0,0,3,0,0,3,0,47,0,0,1,0,0,0,128,0.84
"Scoil Phobail, Chloigh Cheannfhaola, Falcarragh, Letterkenny",Pobalscoil Chloich Cheannfhaola,ChIJaU87XTePX0gRONOJDimcIDs,101,7,3,8,1,6,8,0,0,0,0,0,0,3,0,1,1,1,6,1,0,5,0,30,1,0,0,0,1,0,83,0.82
"Coláiste Cholmcille, Ballyshannon",Colaiste Cholmcille,ChIJr26bjBv-XkgRnp2f9xMY8Wo,111,8,2,4,4,12,5,1,0,0,2,0,0,1,0,1,0,0,14,0,1,20,0,13,2,0,1,0,0,0,91,0.82
"Ghairmscoil Chu Uladh, Beal an Atha Mhoir, An Clochan, Leifear",Gairmscoil Chú Uladh,ChIJ_eoRWHOiX0gRbaep1VW1Cts,48,0,1,1,1,1,11,0,0,0,0,0,0,0,0,0,0,0,2,0,0,0,0,21,0,0,1,0,0,0,39,0.81
"The Rosses Community School, Dungloe, Donegal",Rosses Community School,ChIJjXp1bVJxX0gRSOK8QlwODms,61,2,0,4,0,3,8,0,0,0,0,0,1,0,0,0,0,0,1,0,0,8,0,21,0,0,0,0,0,0,48,0.79
"St Eunan’s College, Letterkenny",St Eunan's College,ChIJe1o2NcmUX0gRrA8AyqJV2BA,133,11,2,6,0,8,12,1,0,1,1,0,1,4,0,0,0,0,3,1,0,9,1,40,0,0,0,0,1,0,102,0.77
"Crana College, Buncrana",Crana College,ChIJ5QMaaqH7X0gRiecNBVSaWaQ,70,2,3,1,2,3,10,0,0,0,1,0,0,0,0,0,0,0,1,0,1,3,0,26,0,0,0,0,0,0,53,0.76
"St Columba’s Comprehensive Sch, Glenties, Donegal",St Columbas Comprehensive School,ChIJXz6sLJALX0gRksaM-OgmKyE,78,1,1,3,2,4,9,0,0,0,2,0,0,3,0,0,0,0,5,0,0,9,0,20,0,0,0,0,0,0,59,0.76
"Scoil Mhuire, St Orans Road, Buncrana",Saint Orans Road,ChIJFc9ybKD7X0gRbcxcxhV56Bo,104,6,0,3,1,4,11,0,0,1,3,0,0,0,1,1,0,0,2,0,0,14,0,28,0,0,0,1,0,0,76,0.73
"Gairmscoil Mhic Diarmada, Oilean Arainn Mhoir, Leitir Ceannain, Contae Dhun Na Ngall",Arranmore,ChIJc4c6o5dvX0gRfypB0_z_FQ0,11,0,0,0,0,0,1,0,0,0,0,0,0,0,0,0,0,0,3,0,0,0,0,4,0,0,0,0,0,0,8,0.73
"Carndonagh Community School, Carndonagh",Carndonagh Community School,ChIJjQmgs7UBYEgRmBIfwDr7W88,172,7,0,7,1,20,10,1,2,3,4,0,0,1,0,0,1,0,5,0,0,14,0,45,0,0,0,0,0,0,121,0.7
"Mulroy College, Milford, Letterkenny",Mulroy College,ChIJ0dn0GNuSX0gRZ8Y05Cgm4so,52,0,0,1,0,3,3,0,0,0,0,0,0,1,0,0,0,0,1,0,0,6,0,20,0,0,1,0,0,0,36,0.69
"Royal and Prior, Comprehensive School, Raphoe, Lifford",Royal and Prior School Raphoe Co Donegal,ChIJ6czEyovBX0gR-f6026HZ4Cg,98,4,0,2,2,3,7,0,1,3,7,0,0,1,0,0,0,0,4,0,0,2,0,29,0,0,0,1,0,0,66,0.67
"St. Catherine’s Vocational Sch, Donegal Road, Killybegs",St Catherines Vocational School,ChIJkznXb18aX0gR70po0cvEibQ,50,0,1,1,1,0,8,0,0,0,2,0,0,1,0,0,2,0,2,0,0,3,0,11,0,0,0,0,0,0,32,0.64
"Errigal College, Windyhall, Letterkenny",Errigal College,ChIJ46HkjEvrX0gR_dDdo6XonYg,33,0,0,0,0,0,1,0,0,0,2,0,0,1,0,0,0,0,0,0,0,1,0,16,0,0,0,0,0,0,21,0.64
"Deele College, Rath Bhoth, Leifear",Deele College Vocational School,ChIJrx_msCDCX0gR_Gh_uz6NbJ0,92,1,0,2,0,2,4,0,0,0,0,0,0,0,0,0,0,0,2,0,0,4,0,43,0,0,0,0,0,0,58,0.63
"Moville Community College, Carrownaff, Moville",Moville Community College,ChIJrZ2HeU4bYEgR0rP6Ghbgjnw,93,2,3,2,0,2,9,0,0,0,4,0,0,3,0,0,1,0,5,0,1,7,0,19,0,0,0,0,0,0,58,0.62
"Finn Valley College, Drumboe Lower, Stranorlar",Finn Valley College,ChIJt9tQl86-X0gRdHcrIM_vvUM,34,0,0,0,0,1,2,0,0,1,0,0,0,0,0,0,0,0,0,0,0,0,0,15,0,0,0,0,0,0,19,0.56
"Coláiste Eoin, Bóthar Stigh Lorgan, Baile an Bhóthair, An Charaig Dhubh",Coláiste Eoin,ChIJx9laoCcJZ0gRkeo4u0kos3s,75,42,14,4,1,2,0,1,0,0,0,0,0,11,0,0,0,0,0,4,1,0,1,0,0,0,0,0,1,2,84,1.12
"*Blackrock College, Blackrock",Blackrock,ChIJyeakaRn9tIcRt6gc4NLk2Ho,197,115,33,1,2,3,5,2,0,0,0,0,0,44,1,0,0,0,0,7,0,0,0,0,0,1,0,0,3,3,220,1.12
