"Coláiste Chillian, Bothar Nangor, Cluain Dolcain, Baile Atha Cliath 22",Coláiste Chilliain,ChIJcZe3wUFzZ0gR-MlkjgAeTP0,47,4,6,3,0,6,0,0,0,0,0,2,0,10,3,0,0,0,0,2,1,0,0,0,0,0,0,0,2,0,39,0.83
"Moyle Park College, Clondalkin",Moyle Park College,ChIJecLek0NzZ0gRkGMn9qKml-g,86,3,5,5,0,4,0,0,0,0,0,1,3,11,20,0,0,0,1,0,1,0,0,0,1,0,0,0,0,0,55,0.64
"Coláiste Bride, Cluain Dolcain, Baile Atha Cliath 22",Coláiste Bríde,ChIJH9OYXkVzZ0gR9Y9eQmqrAAk,130,4,7,3,1,17,1,0,0,0,0,3,5,11,26,1,0,0,0,1,0,0,1,0,0,0,0,0,1,0,82,0.63
"Deansrath Community College, Westbourne Rise, Clondalkin",Deansrath Community College,ChIJt1kP7nJzZ0gRRRkJo8j2auw,44,0,2,1,0,1,0,1,0,0,0,3,0,4,4,0,0,1,0,0,1,0,0,0,1,1,0,0,0,0,20,0.45
"St. Kevin’s Comm. College, Fonthill Road, Clondalkin",St. Kevin's Community College,ChIJnVy9wN5yZ0gRAX15Z6yzekY,30,1,0,1,0,4,0,0,0,0,0,1,0,0,4,0,0,0,1,0,0,0,0,0,0,0,0,0,0,0,12,0.4
"Collinstown Park Comm. College, Rowlagh, Clondalkin",Collinstown Park Community College,ChIJxR6sRiRzZ0gRxO-ca2Edimk,71,8,0,0,0,1,0,0,0,0,0,3,1,0,8,0,0,0,0,0,0,0,0,0,0,0,0,0,0,0,21,0.3
"Old Bawn Community School, Old Bawn, Tallaght",Old Bawn Community School,ChIJw5IlT8p0Z0gRcBYfdhj4B9s,116,6,9,4,0,7,0,0,0,0,0,4,1,12,25,0,0,0,1,0,1,0,0,0,0,3,0,0,1,0,74,0.64
"Coláiste De Hide, Br Chaisleáin Thigh Motháin, Tamhlacht, Baile Atha Cliath 24",Colaiste de hIde,ChIJW7eUh1sLZ0gRGa5GkWH3cZY,41,3,1,0,0,2,0,0,0,0,0,1,1,5,8,0,0,1,0,0,0,0,0,0,0,0,0,0,1,1,24,0.59
"Tallaght Community School, Balrothery, Tallaght",Tallaght Community School,ChIJHUhGdWoLZ0gRwQELStu9sSQ,88,4,7,1,0,4,0,1,0,0,0,1,0,9,24,0,0,0,0,0,0,0,0,0,0,0,0,0,0,0,51,0.58
"Firhouse Community College, Firhouse Road ",Firhouse Community College,ChIJGSRkyToLZ0gRsX3liejq3Do,82,4,3,4,0,4,0,0,0,0,0,2,1,12,13,0,0,0,0,1,1,0,0,0,0,0,0,0,2,0,47,0.57
"St Mark’s Community School, Cookstown Road, Tallaght",St Marks Community School,ChIJXTeQjLt0Z0gRkDNvoIDJN4M,150,1,4,2,1,10,0,0,0,0,0,6,3,15,26,0,0,0,1,0,3,0,0,0,0,0,1,0,0,0,73,0.49
"St Aidan’s Community School, Brookfield, Tallaght ",St. Aidan's Community School,ChIJnz6iw5N0Z0gR5ipLfXsDnKU,53,2,1,0,0,1,0,0,0,0,0,0,1,3,7,0,0,0,0,0,0,0,0,0,0,0,0,0,2,0,17,0.32
"Mount Seskin Community College, Jobstown, Tallaght",Mount Seskin Community College,ChIJl2RVIfJ0Z0gRLIdrCrkzKYs,53,1,0,2,0,4,0,0,0,0,0,3,1,2,2,0,0,0,0,0,1,0,0,0,0,0,0,0,0,0,16,0.3
"Killinarden Community School, Killinarden, Tallaght",Killinarden Community School,ChIJK_0jHel0Z0gRNVHn0JTREKc,65,1,1,0,1,2,0,0,0,0,0,1,0,0,8,0,0,1,0,1,2,0,0,0,0,0,0,0,1,0,19,0.29
"Colaíste na Coiribe, Bothar Thuama, Gaillimh",Coláiste na Coiribe,ChIJE2aFp8GWW0gR0NykGLolX6s,57,2,0,1,2,0,49,0,0,0,0,0,0,1,0,1,0,0,6,1,0,0,0,0,1,0,0,3,0,0,67,1.18
"Salerno Secondary School, Threadmill Road, Salthill, Galway",Salerno Secondary School,ChIJVe5SpUuWW0gR_fugIp3hTdM,75,10,11,1,6,0,45,1,0,0,0,0,0,0,0,2,0,0,6,0,0,0,0,0,0,0,1,3,0,0,86,1.15
"Mean Scoil Ard Na Mara, Cinnmhara, Gaillimh",Árd Na Mara,ChIJLY6wbE2WW0gRgMkE5KSdl7g,46,2,3,2,6,1,15,4,0,0,0,0,0,2,0,1,1,1,6,2,0,3,0,1,1,0,0,0,0,0,51,1.11
"St. Joseph’s Patrician College, Nuns’ Island, Galway",Saint Joseph's Patrician College - The Bish,ChIJwaDCa_qWW0gRbdl7NTkKK0Y,124,2,0,0,4,0,83,1,0,0,0,0,0,1,0,0,0,0,36,0,1,0,0,0,4,0,0,0,0,0,132,1.06
"Dominican College, Taylors Hill, Galway City",Dominican College,ChIJnSfJbFGWW0gR3mZfExrwI8s,107,3,1,0,5,0,69,0,0,0,0,0,0,2,0,4,0,0,20,1,0,0,0,0,2,0,0,1,0,2,110,1.03
"Coláiste Iognáid, Sea Road, Galway",Coláiste Iognáid (The Jes),ChIJNbbAEvmWW0gRT0Xift2Pv2Y,8,1,6,1,4,1,54,3,0,0,1,0,0,1,0,0,0,0,12,1,1,1,0,0,0,0,0,1,1,0,89,1.01
"Coláiste Chroi Mhuire Gan Smal, An Spideal, Gaillimh",Coláiste Chroí Mhuire,ChIJda1041e6W0gRX_CbB_FttHc,27,0,0,0,1,0,11,0,0,0,0,0,0,0,0,1,0,0,7,0,0,0,1,0,2,0,0,3,0,0,26,0.96
"Scoil Bhride, Clochar na Trocaire, Tuaim",Scoil Bhríde,ChIJKedWe7T2W0gRmroN2Bl-Yds,50,0,1,1,1,1,15,2,1,0,0,0,0,0,0,4,1,0,5,0,1,7,0,1,1,0,0,4,0,0,46,0.92
"Clochar na Toirbhirte, Athcinn",Headford,ChIJe6nLOefrW0gRcNIxl6nHAAo,137,5,2,1,12,0,34,3,1,0,0,0,0,0,0,3,1,0,49,0,0,2,0,1,4,0,0,3,1,1,123,0.9
"Calasanctius College, Mary Nihill, Oranmore",Calasanctius College,ChIJbfOiX0qQW0gR9zEHUF-GRFw,124,7,4,0,10,2,54,0,0,0,0,0,0,1,0,1,0,0,17,1,0,2,0,0,4,1,0,5,1,0,110,0.89
"Our Lady of Mercy College, Woodford, Loughrea",Loughrea,ChIJo5MYLwN5XEgRoIcxl6nHAAo,17,1,0,0,1,0,5,0,0,0,0,0,0,0,0,1,0,0,3,0,1,0,0,0,1,0,0,2,0,0,15,0.88
"Holy Rosary College, Mountbellew",Holy Rosary College,ChIJb19G83oNXEgRame5m93jrV8,93,3,0,1,8,1,27,2,2,0,0,0,0,1,0,11,0,0,12,1,1,3,1,0,2,1,0,5,0,0,82,0.88
"Scoil Chuimsitheach Chiaráin, An Cheathrú Rua, Co.na Gaillimhe",Scoil Chuimsitheach Chiaráin,ChIJ7V0xwapMWkgRXTN2HWoX8Y8,50,1,0,1,6,0,21,0,0,0,0,0,0,0,0,3,1,0,6,0,0,1,1,0,1,0,0,2,0,0,44,0.88
"Presentation College, Athenry ",Presentation College,ChIJX9rFWhSJW0gRe93uPjJG1k4,166,3,1,4,11,3,63,3,3,0,0,0,0,3,0,5,0,0,34,0,0,1,0,0,1,0,0,8,0,1,144,0.87
"Garbally College, Garbally Park, Ballinasloe",Garbally College,ChIJTVOMCN90XEgRtQ14iT_kMUY,63,3,1,2,6,3,8,0,0,0,0,0,0,0,0,5,1,0,18,0,0,1,1,0,2,3,0,0,0,0,54,0.86
"St Cuan’s College, Castleblakney, Ballinasloe",St Cuans College,ChIJrXtNFapyXEgRHfMmEcDYoks,42,1,0,1,3,0,10,0,1,0,0,0,0,0,0,5,1,0,10,0,0,0,0,0,0,0,0,4,0,0,36,0.86
"St. Paul’s Secondary School, Oughterard",St Pauls Secondary School,ChIJc3sSu8TGW0gRYKr9SAhHqdU,62,2,2,1,7,0,22,0,1,0,0,0,0,1,0,2,0,1,12,0,0,0,0,0,1,0,0,1,0,0,53,0.85
"Gairm Scoil, Baile Locha Riach",Gaelscoil Riabhach,ChIJax9VDeV4XEgRLS-hsBYT1hs,105,0,1,0,6,1,37,0,0,0,0,0,0,1,0,10,0,0,22,0,1,0,0,0,7,0,0,3,0,0,89,0.85
"Coláiste Einde, Threadneedle Road, Salthill, Galway",Coláiste Éinde - St. Enda's College,ChIJ9SqB20uWW0gRm6thYvK0pQ0,133,3,3,1,3,2,48,0,0,0,0,0,0,2,0,5,1,0,36,0,0,1,0,1,2,0,0,3,0,0,111,0.83
"Presentation College, Currylea, Tuam",Presentation College,ChIJLfUnfLX2W0gRzzV0j36NSX8,85,6,2,1,7,1,29,0,1,0,0,0,0,0,0,5,0,0,9,1,0,2,0,0,2,0,0,3,0,0,69,0.81
"St. Killian’s Community College, New Inn, Ballinasloe",St. Killian's College,ChIJc_fLtyhxXEgRp_kd_XhVF-s,15,0,0,1,0,0,2,0,0,0,0,0,0,0,0,5,0,0,3,0,0,0,1,0,0,0,0,0,0,0,12,0.8
"Ardscoil Mhuire, Mackney, Ballinasloe",Ard Scoil Mhuire ballinasloe,ChIJ2_VD1FBoXEgRT7jLSpOX9bs,78,1,1,5,8,0,19,0,0,0,0,0,0,1,0,10,0,0,6,0,0,0,0,1,4,0,0,6,0,0,62,0.79
"Coláiste Mhuire, Beal Atha Ghartha",Colaiste Mhuire,ChIJBetGrjIUXEgRpjZxkhcxX7k,47,1,0,2,3,1,7,0,0,0,0,1,0,1,0,6,0,0,10,0,1,1,0,0,1,0,1,0,0,1,37,0.79
"Community School, Portumna, Ballinasloe",Portumna Community School,ChIJ2YSPXXKKXEgRFExJDjQzzLg,47,0,1,0,3,2,10,0,0,0,0,0,0,0,0,5,0,0,11,0,0,1,0,0,1,2,0,1,0,0,37,0.79
"Gort Community School, Gort",Gort Community School,ChIJv2DZyquCW0gRAHJ3g7yZtqo,90,2,2,2,5,1,14,2,0,0,0,0,0,0,0,6,1,0,21,0,0,2,0,0,5,1,0,5,0,1,70,0.78
"Gairm Scoil na bPiarsach, Ros Muc, Gaillimh",Coláiste na bPiarsach,ChIJ_c21clG1W0gRNDij4PFd_Lw,12,0,0,0,1,0,2,0,0,0,0,0,0,0,0,2,0,0,2,0,0,0,0,1,1,0,0,0,0,0,9,0.75
"St Raphael’s College, Loughrea",St Raphaels College,ChIJPxJqkhl5XEgRzUICQmStj-k,66,0,0,1,1,0,17,4,0,0,0,0,0,0,0,4,0,0,14,0,0,2,0,0,3,0,0,3,0,0,49,0.74
"St. Jarlath’s College, Tuam",St. Jarlath's College,ChIJweZor7X2W0gRKlWKtMXL3dc,93,0,0,1,8,1,34,0,0,0,0,0,1,0,0,1,1,0,21,0,0,0,0,0,0,0,0,1,0,0,69,0.74
"Dunmore Community School, Dunmore, Tuam",Dunmore Community School,ChIJtWJWu5UHXEgRSauUBjOadhg,42,0,0,1,3,0,8,0,0,0,0,0,0,0,1,3,0,0,11,0,0,2,0,0,0,0,0,0,0,0,29,0.69
"Coláiste an Eachréidh, An Coiléar Bán, Baile Átha An Rí",Coláiste an Eachréidh,ChIJ8brukBaJW0gRyAEIiYw-ANQ,15,0,0,0,1,0,7,0,0,0,0,0,0,0,0,0,0,0,1,1,0,0,0,0,0,0,0,0,0,0,10,0.67
"Scoil Phobail Mhic Dara, Carna, Galway",Scoil Phobail Mhic Dara,ChIJ28nUxhtIWkgRU4djdrrm1Vo,15,0,0,0,2,0,6,0,0,0,0,0,0,0,0,0,1,0,1,0,0,0,0,0,0,0,0,0,0,0,10,0.67
"Scoil Phobail, Clifden, Galway",Scoil Phobail,ChIJfxAfQE07WkgRf52gLVCdwHg,65,2,0,0,3,0,18,0,0,0,0,0,0,1,0,0,1,0,15,0,0,3,0,0,0,0,0,0,0,0,43,0.66
"Glenamaddy Community School, Glenamaddy",Glenamaddy Community School,ChIJE9ABz2MFXEgRoGubf-kPXJA,72,4,0,0,7,0,10,0,1,0,0,0,0,0,0,3,1,0,12,0,0,6,0,1,1,0,0,0,1,0,47,0.65
"Gairm Scoil, Baile Atha an Ri",Gairmscoil Mhuire,ChIJoXyrRxGJW0gRUje9omfWHcs,86,1,0,0,0,0,18,1,0,0,0,0,0,2,0,7,1,0,22,0,0,1,0,0,3,0,0,0,0,0,56,0.65
"Coláiste Cholmcille, Indreabhán, Gaillimh",Coláiste Cholmcille,ChIJNcxLfPGwW0gRnBg8NnsAZX8,63,1,0,1,8,0,14,0,0,0,0,0,0,0,0,0,0,0,6,0,1,5,0,0,1,0,1,3,0,0,41,0.65
"Gairm Scoil, Sheain Mhic Eil, Tuaim",Tuam,ChIJG-0QC7X2W0gRICcyl6nHAAo,27,0,0,0,0,0,1,0,0,0,0,0,0,0,0,2,0,0,8,0,0,2,1,1,1,0,0,1,0,0,17,0.63
"St. Mary’s College, St. Mary’s Road, Galway",St Marys College,ChIJQfHCd_iWW0gR9Vq7cBOPOw4,74,1,0,1,1,0,21,0,0,0,0,0,0,0,0,2,0,0,19,0,0,0,0,0,0,0,1,0,0,0,46,0.62
"Colaiste An Chreagáin, Mountbellew, Ballinasloe",Coláiste an Chreagáin,ChIJJTw_AnMNXEgR6-_5iajjdao,11,2,0,0,0,0,0,0,0,0,0,0,0,0,0,0,0,0,3,0,0,0,0,0,0,1,0,0,0,0,6,0.55
"Coláiste Naomh Feichín, Corr na Mona",Coláiste Naomh Feichín,ChIJS4uUxorPW0gRdJ-JgWbF_xk,24,0,0,0,0,0,7,0,0,0,0,0,0,0,0,0,0,0,1,0,0,2,0,0,0,0,0,1,1,0,12,0.5
"Galway Community College, Moinin na Gciseach, Galway",Galway Community College,ChIJX3PG3caWW0gRr3oErBdQ4tM,41,0,0,0,0,0,4,0,0,0,0,0,0,0,0,1,0,0,11,0,0,0,0,0,0,0,0,0,0,0,16,0.39
"Presentation Secondary School, Presentation Road, Galway",Our Lady's College Galway,ChIJQUolVPeWW0gRaUDGbM3UVVk,37,0,0,0,0,0,6,0,0,0,0,0,0,0,0,0,0,0,8,0,0,0,0,0,0,0,0,0,0,0,14,0.38
"Pobailscoil Chorca Dhuibhne, An Gróbh, Daingean Ui Chuis",Pobalscoil Chorca Dhuibhne,ChIJe1TpCcT7T0gRsMST_Z4Eeug,62,1,1,1,5,0,3,26,0,0,0,0,0,1,0,0,15,0,0,3,2,0,3,0,1,1,0,6,0,2,71,1.15
"Coláiste Ide, An Daingean, Tra Li",Tralee,ChIJ6WJcGmQ1RUgRfzYwl2PgcWw,23,3,2,3,1,0,2,6,2,0,0,0,0,0,0,0,0,0,1,0,0,0,4,0,0,0,0,1,1,0,26,1.13
"Presentation Secondary School, Clochar na Toirbhirte, Castleisland",Presentation Secondary School Castleisland,ChIJp9gLfAQuRUgRyqPyYPMfLug,27,0,0,0,5,0,1,7,0,0,0,0,0,0,0,0,2,0,0,0,0,0,7,0,2,1,0,4,0,0,29,1.07
"Presentation Secondary School, Listowel",Presentation Secondary School,ChIJqRzSkwDRWkgRmj0aEapLrnU,52,0,0,0,10,0,5,19,0,0,0,0,0,0,0,1,5,0,0,0,0,0,6,0,2,1,0,5,0,0,54,1.04
"St. Michael’s College, Listowel",St. Michael's College,ChIJFdvUcgPRWkgR4YEgDrZvwTo,29,1,0,0,8,0,1,7,0,0,0,0,0,0,0,0,7,0,1,0,0,0,1,0,1,0,0,2,0,0,29,1
"Coláiste na Sceilge, Caherciveen",Colaiste na Sceilge,ChIJceY2RRvzT0gRYZs4Kv4cikk,79,4,0,1,8,2,3,16,1,0,0,0,0,1,0,0,22,0,0,0,1,0,12,0,3,0,0,3,0,1,78,0.99
"St Brigid’s Secondary School, New Street, Killarney",St Brigids Secondary School (Presentation College),ChIJSXIWPwY8RUgRm40U210ND4k,70,5,3,1,8,0,5,21,0,0,0,0,0,0,0,0,10,0,0,2,0,0,8,0,0,1,0,5,0,0,69,0.99
"St. Brendan’s College, Killarney",St. Brendan's College,ChIJk91_awc8RUgRJK9dvGcUY-Y,69,2,0,2,11,0,1,21,0,0,0,1,0,0,0,0,12,0,0,0,0,0,15,0,0,0,0,3,0,0,68,0.99
"St. Joseph’s Sec School, Doon Road, Ballybunion",St Josephs Secondary School,ChIJi62FXc3FWkgRtX2O0MYu1UA,28,1,1,0,6,0,0,2,0,0,0,0,0,0,0,0,2,0,0,0,0,0,10,0,2,1,0,1,0,0,26,0.93
"Kenmare Community School, Kenmare, Killarney, Co.Kerry",Kenmare,ChIJGZ38CKtsRUgR8Bcyl6nHAAo,90,1,0,0,16,0,3,18,0,0,0,0,0,1,0,0,29,0,0,0,0,0,6,0,0,1,0,6,0,0,81,0.9
"Tarbert Comprehensive School, Tarbert, Listowel",Tarbert Comprehensive School,ChIJTyoNgLzYWkgRYnEqHXnaMco,126,0,2,1,22,0,4,27,0,0,0,0,0,1,0,1,7,0,3,0,1,0,11,0,14,1,0,11,0,2,108,0.86
"Presentation Secondary School, Miltown, Killarney",Presentation Secondary School,ChIJ7zVqI2VIRUgRsLue62N5sto,103,2,2,1,14,0,7,14,0,0,0,0,0,1,0,3,12,1,0,0,0,0,20,0,0,0,0,9,0,0,86,0.83
"St. Mary’s CBS The Green, Dan Spring Road, Tralee",CBS The Green,ChIJrU4nCXA1RUgRG8eDI9XigNU,125,2,1,0,20,0,5,16,0,0,0,0,0,0,0,2,12,0,5,0,0,0,33,0,2,2,0,0,0,0,100,0.8
"Presentation Sec School, Tra Li",Presentation Secondary School,ChIJH5E2Z05SRUgRY1Q3WLyhNsE,122,1,5,1,12,0,4,27,0,0,0,0,0,0,0,0,5,0,2,0,1,0,20,0,3,1,0,9,0,0,91,0.75
"Scoil Phobail Sliabh Luachra, Rathmore",Scoil Phobail Sliabh Luachra,ChIJby7j7NUgRUgRiM1BJ8ZmYBY,86,1,0,0,12,0,1,15,1,0,0,0,0,0,0,0,15,2,0,0,0,0,5,0,1,3,0,7,0,0,63,0.73
"Castleisland Community College, Tonbwee, Castleisland",Castleisland Community College,ChIJWVrwyRouRUgRV8HrJnGRX08,66,0,0,0,9,1,2,10,0,0,0,0,0,0,0,0,8,0,0,0,0,0,10,0,3,1,0,4,0,0,48,0.73
"An Scoil Idirmheanach, Cill Orglan",Killorglin,ChIJI5Zzd8JFRUgRYHsxl6nHAAo,171,6,5,1,14,1,6,53,1,0,0,0,0,2,0,1,15,0,3,1,0,0,10,0,2,0,0,3,0,0,124,0.73
"Meán Sc. Nua an Leith Triúigh, Castlegregory",Meán Scoil Nua an Leith-Triúigh,ChIJkXH0x5xTRUgRPodsuMDXFPI,25,1,0,0,0,0,0,3,0,0,0,0,0,0,0,0,1,0,1,0,0,0,8,0,0,2,0,2,0,0,18,0.72
"Killarney Community College, New Road, Killlarney",Killarney Community College,ChIJWeYCrPg7RUgR0Sv76FnVb9w,61,0,2,0,4,0,0,5,0,0,0,0,0,0,0,0,8,0,0,0,0,1,16,0,3,0,0,0,0,0,39,0.64
"Vocational School, Clash, Tralee",Kerry College of Further Education,ChIJWSL-x3I1RUgRfT4h2aYrF6M,20,1,0,0,0,0,0,1,0,0,0,0,0,0,0,0,1,0,0,0,0,0,8,0,0,0,0,0,0,0,11,0.55
"St Patrick’s Secondary School, Castleisland",Pat's. Castleisland,ChIJZaB8lAMuRUgRpmffV26jy2c,36,0,0,0,2,0,2,4,0,0,0,0,0,0,0,1,4,0,0,0,0,0,5,0,0,1,0,0,0,0,19,0.53
"Killorglin Community College, Killorglin",Killorglin Community College,ChIJYV5jwsJFRUgRvjkkkY2s1xU,34,1,0,0,3,0,0,0,0,0,0,0,0,0,0,0,2,0,1,0,0,0,5,0,0,0,0,0,0,0,12,0.35
"*Clongowes Wood College, Naas",Clongowes Wood College SJ,ChIJgSsqWRh5Z0gRpFH3-vFw4Q4,76,21,17,7,0,5,3,1,0,0,0,0,1,25,0,0,0,0,0,3,0,0,0,0,0,0,0,0,0,2,85,1.12
"*Dominican College, Droichead Nua",Newbridge College,ChIJcdae9vx_XUgROK13eKIlnLg,133,26,15,9,6,18,4,5,0,0,0,0,2,18,2,0,1,1,2,2,8,1,0,0,3,2,0,0,1,1,127,0.95
"Mean Scoil Iognaid Ris, Scoil na mBraithre, Naas",Meánscoil Iognáid Rís,ChIJX8eWS714Z0gRmCl0PUrR60w,151,19,12,17,1,27,3,1,0,0,0,0,3,23,7,1,0,0,4,1,16,0,1,0,2,3,0,0,1,1,143,0.95
"St Wolstan’s Community School, Ballymakealy, Clane Road, Celbridge",Wolstan's School,ChIJ23zHCPpwZ0gRadrkAS4ri2M,114,14,19,7,1,28,2,0,0,0,1,8,0,12,2,1,0,2,1,1,2,0,0,1,0,0,0,0,3,1,106,0.93
"Maynooth Post Primary School, Moyglare Road, Maynooth",Maynooth Post Primary,ChIJ47oJKKhxZ0gRGQakvGTONdU,188,9,17,9,2,72,5,2,0,0,0,13,1,15,2,2,3,1,0,0,1,0,0,0,0,1,2,0,4,0,161,0.86
"Ardscoil na Trionóide, Rathstewart, Athy",Ardscoil na Trionoide,ChIJCWRtZ_JvXUgRdsLPm1Z2vHk,129,9,3,7,7,24,5,1,0,0,0,2,0,4,2,1,0,0,0,0,35,0,0,0,1,6,0,1,1,0,109,0.84
"Kildare Town Community School, Dunmurray Road, Kildare,",Kildare Town Community School,ChIJDWtd0rd4XUgReo3X_2mmZSU,77,5,1,2,2,17,4,1,0,0,0,0,0,5,2,3,1,0,0,1,14,0,0,1,1,1,1,0,1,0,63,0.82
"Coláiste Chiarain, Pobail Scoil, Leim an Bhradáin",Colaiste Chiarain,ChIJzUObvYpxZ0gRMPxW8ZdHE28,104,3,4,7,0,28,1,0,0,0,0,13,5,10,4,1,1,0,2,1,1,0,0,0,0,2,0,0,2,0,85,0.82
"Cross and Passion College, Kilcullen",Cross & Passion College,ChIJ9xBVTsGAZ0gRG_u_qhwyeRM,106,13,2,4,5,9,2,4,1,0,0,0,0,11,3,3,0,1,3,0,13,0,1,0,3,6,0,0,1,1,86,0.81
"Confey Community College, Confey, Leixlip",Confey Community College Leixlip,ChIJucUxoB1yZ0gRemQXMCfUp78,109,7,4,5,0,24,0,0,0,0,0,8,12,13,6,1,1,1,0,0,0,0,0,0,0,1,1,0,2,0,86,0.79
"Salesian College, Maynooth Road, Celbridge",Salesian College,ChIJ4wQpvrRxZ0gRnyyorotH-Ss,124,12,5,5,1,27,3,1,0,0,0,8,1,24,6,0,1,0,0,0,0,1,0,0,0,1,0,0,0,0,96,0.77
"Scoil Mhuire Community School, Clane, Naas",Scoil Mhuire Community School,ChIJUXO_J1AOZ0gRyloY3xqBng8,151,8,5,12,1,37,2,0,0,0,0,1,1,15,8,2,0,0,0,2,10,1,1,0,1,3,0,0,1,0,111,0.74
"Scoil Dara, Cill Choca, An Nas",Scoil Dara Kilcock,ChIJwy6jzfpyZ0gRyyf25XhQKrQ,144,10,4,9,1,35,4,0,0,0,0,12,1,10,1,5,0,1,1,0,3,0,0,1,0,6,0,0,0,0,104,0.72
"Ardscoil Rath Iomgháin, Rathangan, Kildare",Ardscoil Rath Iomgháin,ChIJrSS3H-aCXUgRbNNy1V2QhZ8,94,4,5,2,4,8,3,1,0,0,0,0,0,6,2,1,0,1,9,1,10,0,1,0,1,4,0,3,0,0,66,0.7
"St Paul’s Secondary School, Monasterevin",St Paul's Secondary School,ChIJeSijRKp3XUgRVpS9tKnfjuw,46,2,1,1,0,5,0,0,0,0,0,0,2,1,0,0,0,0,0,0,11,0,0,1,2,4,0,0,0,0,30,0.65
"Mean Scoil An Teaghlaigh Naofa, Droichead Nua",Newbridge,ChIJycrBT-Z_XUgRMMwxl6nHAAo,106,3,3,6,2,13,2,0,0,0,0,2,1,10,2,3,0,0,1,0,14,0,0,0,1,2,3,0,0,0,68,0.64
"Patrician Secondary School, Newbridge",Patrician Secondary School,ChIJa78k_giAZ0gRQSn9DfJNNs8,124,10,4,4,3,13,5,0,0,0,0,1,0,15,4,0,2,0,1,1,14,1,0,0,1,0,0,0,0,0,79,0.64
"Piper’s Hill College, Killashee, Naas",Piper's Hill College,ChIJB9PCegWCZ0gR4Ulkee1PILQ,100,5,3,7,2,10,4,0,0,0,0,2,2,10,5,0,0,0,0,0,9,1,0,0,0,1,0,0,0,0,61,0.61
"Coláiste Lorcain, Castledermot, Athy",Coláiste Lorcáin,ChIJPf_ba-xvXUgRs_QaJlAb7Wg,63,3,2,5,1,3,3,0,0,0,0,0,0,0,0,1,0,1,1,0,12,0,1,0,1,2,0,0,0,0,36,0.57
"Athy Community College, Tomard, Athy, Co.Kildare",Athy College,ChIJyzZcJYxvXUgR8iEx6fawvDg,51,0,2,0,1,3,1,1,0,0,0,0,0,1,1,0,0,1,0,0,14,0,0,0,1,1,0,0,0,0,27,0.53
"St. Farnan’s Post Primary Sch., Prosperous, Naas",St Farnan's Post Primary School,ChIJgTovxv97Z0gRODl_edEWSMU,72,1,0,1,1,11,0,0,0,0,0,3,1,3,0,2,0,0,0,0,7,0,0,0,2,5,0,0,0,0,37,0.51
"Gael-Cholaiste Chill Dara, Seanbhóthar Luimnigh, Nas na Ríogh",Gael Choláiste Chill Dara,ChIJc-mcyLx4Z0gR2MgzAMev8kQ,28,0,2,3,0,4,1,0,0,0,0,0,0,0,1,0,0,0,0,1,2,0,0,0,0,0,0,0,0,0,14,0.5
"St Conleth’s Community College, Droichead Nua",Saint Conleth's Community College,ChIJX2X9b-R_XUgRlC9RvHMinqk,24,0,1,0,0,1,0,0,0,0,0,0,0,0,2,0,0,0,0,0,7,1,0,0,0,0,0,0,0,0,12,0.5
"Post Primary School, Mc Swiney Road, Curragh",Curragh Post Primary School,ChIJOyEvOqR_XUgRi5tP78SpyuY,24,0,0,0,0,0,0,0,0,0,0,0,0,0,0,1,0,0,0,0,6,0,0,0,0,0,0,0,0,0,7,0.29
"Coláiste Pobal Osraí, Bothar Urmhumhan, Cill Chainnigh",Colaiste Pobail Osrai,ChIJCcQ1lJ4wXUgR8998mq6VCWU,15,2,1,0,1,2,1,2,0,0,0,0,0,1,0,0,1,0,0,0,1,0,0,0,0,6,0,0,0,0,18,1.2
"Duiske College, Graignamanagh, Kilkenny,",Duiske College,ChIJTT4jZodMXUgRAUzCChxLG_U,20,1,0,0,1,2,0,1,0,0,0,0,0,0,0,0,0,0,0,0,2,0,0,0,1,13,1,0,0,0,22,1.1
"Scoil Aireagail, Ballyhale, Kilkenny",Scoil Aireagail,ChIJFZR9wMDMQkgReCoJXyhsaA0,22,3,0,0,0,0,0,0,0,0,0,0,0,0,0,2,0,0,2,0,2,0,1,1,0,11,0,1,0,0,23,1.05
"Kilkenny College, Castlecomer Road, Kilkenny",Kilkenny College,ChIJmXYslBM6XUgRn2aQABJ-Mus,121,21,17,12,6,5,5,6,0,1,0,0,0,10,1,2,7,0,6,1,7,0,2,0,3,8,1,1,1,1,124,1.02
"St Brigid’s College, Calainn, Cill Chainnigh",St Brigids College,ChIJZXwIJBcsXUgRfyYVEUuIRUQ,41,2,1,5,5,2,0,3,0,0,0,0,0,0,0,1,3,0,2,0,3,0,1,0,1,10,0,1,0,0,40,0.98
"Scoil na mBraithre Criostaí, Sraid Seamais, Kilkenny",Mean Scoil na mBraithre Criostai,ChIJyXlvGXY6XUgRJlLRVahzwEE,113,10,3,2,11,14,3,18,0,0,1,0,0,0,0,0,3,0,0,1,14,0,0,0,2,23,0,1,0,0,106,0.94
"Presentation Convent, Secondary School, Kilkenny",Presentation Secondary School,ChIJETlhUpYwXUgRSI2v95ri6FI,114,10,6,16,4,10,8,9,0,0,0,0,0,2,1,0,0,1,0,0,5,1,0,0,0,28,1,4,0,0,106,0.93
"St Kieran’s College, College Road, Kilkenny",St Kieran's College,ChIJnRVndJswXUgROSEySIA6phA,125,29,5,9,18,4,4,11,0,0,0,0,1,0,0,0,4,1,0,3,9,0,0,0,1,15,0,1,0,0,115,0.92
"Loreto Convent, Granges Road, Kilkenny",Loreto Secondary School,ChIJ9wWO63A6XUgRljM8QXTe8aU,137,19,11,12,11,8,0,19,2,0,0,0,0,2,0,1,5,3,0,2,1,0,0,0,2,15,2,4,0,1,120,0.88
"Coláiste Mhuire, Johnstown",Colaiste Mhuire,ChIJIb004pIgXUgRIWBKTbexTh4,70,5,0,2,10,1,2,7,0,0,0,0,0,0,0,0,2,1,0,0,3,0,0,0,4,17,0,6,0,0,60,0.86
"Grennan College, Ladywell Street, Thomastown",Grennan College,ChIJD1xpqvk0XUgRa6fDCx5RLNs,49,2,2,2,1,4,0,4,0,0,0,0,0,0,0,0,1,0,0,0,9,0,1,0,0,14,0,0,0,0,40,0.82
"Coláiste Éamann Ris, Kilkenny Road, Callan",Edmund Rice College,ChIJZXwIJBcsXUgRtupzFbirAbU,35,0,0,1,4,2,0,3,0,0,0,0,0,0,0,0,0,0,1,0,5,0,0,0,0,7,0,1,0,0,24,0.69
"Castlecomer Commnunity School, Castlecomer",Castlecomer Community School,ChIJBwv9vzc-XUgR5smoVCN1Ois,87,1,1,4,9,4,4,0,0,0,0,0,2,3,0,0,0,0,0,0,8,0,1,0,0,15,0,2,0,0,54,0.62
"Coláiste Cois Siúire, Mooncoin",Colaiste Cois Siuire,ChIJKSUhhrvaQkgRdEIdE-rulaI,18,0,0,0,2,0,0,0,0,0,0,0,0,0,0,0,0,0,0,0,1,0,0,0,0,5,0,0,0,0,8,0.44
"Kilkenny City Vocational School, New Street, Kilkenny",City Vocational School,ChIJ_VKyE5wwXUgRwzzmmofYPyA,25,0,0,0,0,0,0,0,0,0,0,0,0,0,0,0,1,0,0,0,2,0,0,0,0,1,0,0,0,0,4,0.16
"Community School, Mountmellick, Portlaoise",Mountmellick Community School,ChIJ-12Av80LXUgRbyuvPZLisBA,78,5,0,2,6,4,2,2,0,0,0,0,0,4,0,10,0,1,8,0,18,0,0,0,4,7,0,1,0,0,74,0.95
"Mountrath Community School, Dysartbeigh, Mountrath",Mountrath Community School,ChIJg9cjbtgEXUgRKWiqdY5Myaw,114,6,4,11,9,2,6,6,0,0,0,0,2,6,0,2,0,0,3,0,15,0,0,0,5,10,0,5,1,0,93,0.82
"Clonaslee College, Clonaslee, Portlaoise",Clonaslee Vocational School,ChIJC1puOX8HXUgR-U3cOln_KdA,45,0,0,1,4,1,2,0,0,0,0,0,0,1,1,4,0,0,7,0,4,1,0,0,2,4,0,4,0,0,36,0.8
"Coláiste Iosagain Sec. School, Portarlington",Colaiste Iosagain,ChIJR3rpQm91XUgRrGUYBb1lG6E,129,7,2,2,7,20,9,2,0,0,0,1,1,6,2,3,1,2,1,0,16,2,0,0,4,13,0,1,1,0,103,0.8
"Heywood Community School, Ballinakill, Portlaoise",Heywood Community School,ChIJsbXfdCkRXUgRmJsmAig5pkk,118,6,2,1,16,6,2,3,0,0,0,0,1,4,0,0,1,0,4,0,18,1,1,0,2,17,1,4,1,0,91,0.77
"St.Fergal’s College, Rathdowney, Portlaoise",ST Fergals National School,ChIJn3uhpjceXUgRDwklmR69pf0,45,2,1,0,4,0,2,0,1,0,0,0,0,1,0,1,0,1,2,1,3,0,1,0,5,5,0,3,1,0,34,0.76
"Scoil Criost Ri, Presentation Secondary School, Borris Road, Portlaoise",Scoil Chriost Ri,ChIJFRgNzcsNXUgRjn_jM7faALI,99,0,5,8,10,5,11,0,0,0,0,0,0,3,1,2,0,1,2,1,8,1,0,0,2,5,0,5,2,0,72,0.73
"St Mary’s CBS, Borris Road, Portlaoise",St. Mary's CBS,ChIJCUhgZMsNXUgRdWhQgScnh3Q,102,8,1,6,13,4,6,3,0,0,0,0,0,5,0,2,0,0,3,0,8,0,0,0,1,9,0,3,0,0,72,0.71
"Portlaoise College, Mountrath Rd, Portlaoise",Portlaoise College,ChIJaa__W9MNXUgRBnnv17gkHD4,54,0,0,0,1,2,0,2,0,0,0,0,1,1,0,2,2,0,0,0,9,0,3,0,2,0,0,0,0,0,25,0.46
"Ballinamore Community School, Ballinmore",Leitrim County Library,ChIJgz9EsF9kXkgRSua8vkFaGX4,52,4,1,5,0,11,7,0,1,0,2,0,0,1,0,3,0,1,6,0,0,10,0,0,1,0,0,0,0,0,53,1.02
"Vocational School, Carrigallen",Carrigallen Vocational School,ChIJV73Vu1ZwXkgRTlKPyDCW9IM,42,5,0,3,1,8,9,0,0,0,0,0,0,2,1,1,0,0,5,0,0,3,0,0,0,0,1,0,0,0,39,0.93
"Mohill Community College, Mohill",Mohill Community College,ChIJ8YK8hdp9XkgRwsNvQlqO-bw,63,5,4,6,3,4,6,1,0,1,0,0,0,1,0,3,0,1,3,1,0,6,0,0,1,0,3,2,0,0,51,0.81
"St Clare’s Comprehensive Sch, Manorhamilton",Saint Clare's Comprehensive School,ChIJcxW_g8LwXkgRZS1MtoaqXes,79,1,3,6,2,1,7,0,0,1,0,0,0,2,0,1,0,0,6,1,1,15,0,8,1,0,1,1,0,0,58,0.73
"Community School, Carrick-on-Shannon",Carrick-On-Shannon Community School,ChIJL23nArKFXkgRkd7f4pJXnbY,124,9,2,11,7,10,13,0,0,1,0,0,0,2,0,3,0,1,7,0,1,14,0,5,1,1,0,0,0,0,88,0.71
"Drumshanbo Vocational School, Drumshanbo, Carrick on Shannon",Drumshanbo Vocational School,ChIJo8CoRTyJXkgRE-yVYnr3b04,61,5,0,2,1,1,8,0,0,0,0,0,0,2,0,0,0,0,1,0,1,14,1,5,0,1,0,0,0,0,42,0.69
"Lough Allen College, Drumkeerin, Carrick on Shannon",Lough Allen College,ChIJI31aPfeIXkgRgDFOUWGVsxs,28,0,0,0,0,0,2,0,0,0,0,0,0,1,0,0,1,0,3,0,1,7,0,1,0,0,0,0,0,0,16,0.57
"Laurel Hill Coláiste FCJ, Cnoc na Labhras, Luimneach",Laurel Hill Colaiste FCJ,ChIJNa0KLIRcW0gRyre_Pay-Ypg,62,3,8,0,26,0,2,13,0,0,0,0,0,0,0,0,1,0,0,0,0,0,0,0,4,0,0,9,0,0,66,1.06
"*Glenstal Abbey School, Murroe, Limerick",Glenstal Abbey School,ChIJcbLpZdimXEgRhnjb79QvaYs,31,11,8,2,3,3,0,0,0,0,0,0,0,1,0,0,0,0,1,0,0,0,0,0,1,0,0,0,0,2,32,1.03
"*Villier’s School, North Circular Road, Limerick City",Villiers Secondary School,ChIJ51Dcp41cW0gRslpvo9abeMo,96,9,5,0,28,2,12,5,1,0,0,0,0,2,0,2,0,0,3,1,1,0,0,1,18,1,0,5,0,0,96,1
"Scoil Pol, Cillfhionain, Cill Mhoceallog",Scoil Pol,ChIJ-wFrRXarREgRqGjv5zIoUE4,32,0,0,0,10,0,1,3,0,0,0,0,0,0,0,1,3,0,2,0,0,0,1,0,7,0,0,4,0,0,32,1
"Laurel Hill Secondary School, South Circular Road,, Limerick",Laurel Hill Secondary School,ChIJwUQIzYdcW0gRqdOyM7IGRHg,87,3,0,0,29,0,3,8,0,0,0,0,0,0,0,1,0,0,1,0,1,0,3,0,14,2,0,21,0,1,87,1
"Ardscoil Rís, Brid De Brún, North Circular Road, Limerick",Ardscoil Mhuire,ChIJWyqFIItcW0gR8viutXX04dM,122,3,6,0,61,0,11,9,0,0,0,0,0,0,0,0,1,0,1,0,0,0,0,0,15,0,0,7,0,0,114,0.93
"Gaelcholáiste Luimnigh, Meal Sior Anraí, Luimneach, Sir Harry’s Mall",Gaelcholáiste Luimnigh,ChIJbQmh5mlcW0gRU-8hz0WaCWs,74,2,2,0,31,0,5,6,1,0,0,0,0,1,0,0,1,0,0,0,0,0,0,0,13,0,0,7,0,0,69,0.93
"Crescent College Comprehensive, Dooradoyle, Limerick City",Crescent College Comprehensive,ChIJZzF1sXpbW0gRV9pXUNrDe1I,128,3,5,1,50,0,9,12,0,0,0,0,0,2,0,0,1,0,1,0,0,1,1,0,20,0,0,10,0,0,116,0.91
"Scoil Mhuire agus Ide, Newcastle West",Scoil Mhuire agus Ide,ChIJlQXGaPMxW0gRt9tukipis3A,61,0,3,1,19,0,5,2,1,0,0,0,0,0,0,1,4,0,3,0,1,0,5,0,4,1,0,4,0,0,54,0.89
"Castletroy Community College, Newtown, Castletroy",Bucks County Community College,ChIJe9qmYMtUwYkRsQ-KHFjiNhA,195,3,3,1,75,0,14,18,0,0,0,0,1,1,0,1,3,0,0,1,0,0,0,1,31,0,0,12,0,0,165,0.85
"John the Baptist C.S., Hospital",John the Baptist Community School,ChIJfbGyCulVW0gRDZzUb0UNN4A,147,2,1,0,33,0,1,24,1,0,0,0,0,2,0,0,6,0,0,0,0,0,4,0,21,9,0,19,0,0,123,0.84
"Coláiste Íde and Iosaf, Abbeyfeale Community College, Convent Street, Abbeyfeale",Colaiste Ide agus Iosef,ChIJtepyPIfVWkgRPW6Tu2cq8iQ,85,1,2,0,9,0,5,14,0,0,0,0,0,1,0,0,4,0,1,0,0,0,14,0,10,2,0,6,0,1,70,0.82
"Scoil na Tríonóide Naofa, Doon",Scoil Na Tríonóide Naofa,ChIJmzHkVUKlXEgRUjhq5WTINYU,100,5,0,1,29,0,3,3,0,0,0,0,0,0,0,0,3,0,0,1,0,0,3,0,21,6,0,6,0,0,81,0.81
"Salesian Secondary College, Pallaskenry",Salesian Secondary College,ChIJNZMwSdlAW0gRRKibE1JgLoM,81,1,0,0,24,0,1,2,0,0,0,0,0,0,0,1,0,0,1,0,0,1,4,0,18,1,0,7,0,1,62,0.77
"Mercy Community College, Rathkeale",Coláiste na Trócaire,ChIJr71PfJ03W0gRXj8ewuS4vaQ,57,1,0,0,10,0,4,4,1,0,0,0,0,0,0,0,4,0,2,0,0,0,4,0,9,0,0,3,0,0,42,0.74
"Coláiste Mhuire, Askeaton ",Colaiste Mhuire,ChIJD7SHLiI5W0gRLPbw3eePP8E,83,1,1,1,15,0,2,0,0,0,0,0,0,0,0,0,0,0,3,0,0,0,7,0,20,1,0,10,0,0,61,0.73
"St Munchin’s College, Corbally, Limerick City",St Munchin's College,ChIJpXjIMjZcW0gRskhuYZcxTKw,90,0,1,0,35,1,3,0,0,0,0,0,0,0,0,0,2,0,0,0,0,0,0,0,20,0,0,3,0,0,65,0.72
"Desmond College, Newcastle West",Desmond College,ChIJy_EkUY0xW0gRdBrrPFCg6Wo,64,0,0,0,11,0,1,0,0,0,0,0,0,0,0,0,0,0,1,0,0,0,19,0,9,2,0,3,0,0,46,0.72
"Coláiste Chiaráin, Croom ",Colaiste Chiarain,ChIJh4KGDwVPW0gRPFRK1Qn71n8,122,0,1,1,33,0,5,8,0,0,0,0,0,0,0,0,5,0,0,1,0,0,0,0,23,1,0,8,0,0,86,0.7
"Coláiste Iosaef, Kilmallock",Colaiste Iósaef,ChIJV8HN3sVSW0gR0_-h9j7vNjY,61,0,2,0,11,1,3,6,0,0,0,0,0,0,0,1,0,0,1,0,1,1,1,0,5,2,0,8,0,0,43,0.7
"Hazelwood College, Dromcollogher",Hazelwood College,ChIJGXZNqxXLREgR0rqkC2hLHtQ,95,2,0,0,19,0,2,9,0,0,0,0,0,1,0,1,4,1,1,0,0,0,9,0,9,2,0,5,0,0,65,0.68
