"*St Joseph of Cluny Sec. School, Bellevue Park, Ballinclea Rd, Dun Laoghaire",St Joseph of Cluny Secondary School,ChIJo468x9EHZ0gRslE60lRks4I,69,34,8,3,0,0,2,0,0,0,0,1,0,16,2,2,0,0,0,7,0,0,0,0,0,0,1,0,0,0,76,1.1
"*Holy Child School, Military Road, Killiney",Holy Child Secondary School,ChIJUYt6KuoHZ0gR_gwMH5n3wZs,55,26,21,1,1,0,1,0,0,0,0,1,0,2,0,0,0,0,0,5,0,0,0,0,0,0,0,0,0,0,58,1.05
"Coláiste Iosagain, Br Stigh Lorgan, Baile an Bhothair, An Charraig Dhubh",Coláiste Íosagáin,ChIJG2ofdycJZ0gRFYp4DijeIr8,79,39,18,5,2,2,2,1,0,0,0,1,0,4,0,0,0,0,0,3,1,0,0,0,0,1,0,1,2,1,83,1.05
"St. Benildus College, Upper Kilmacud Road, Stillorgan, Blackrock",St. Benildus College,ChIJcWIRQRMJZ0gRmP2zhusokRU,121,42,3,10,0,3,1,0,0,0,0,0,3,45,9,0,0,0,0,9,0,0,0,0,0,0,0,0,0,1,126,1.04
"*St Andrew’s College, Booterstown Ave, Blackrock",St. Andrew's College,ChIJ07tFM9gIZ0gRd87tXEv6POw,157,49,45,6,1,2,4,0,0,0,0,1,4,26,1,1,0,0,0,15,0,0,2,0,0,1,1,0,2,0,161,1.03
"*Loreto Abbey, Dalkey",Loreto Abbey Dalkey,ChIJiSqqZ00GZ0gRgMEAiPijJUU,91,30,18,7,0,0,1,1,0,0,0,0,1,18,2,0,1,0,0,8,0,0,2,0,0,0,1,0,1,0,91,1
"*Christian Brothers College, Monkstown Park, Dun Laoghaire",Christian Brothers College,ChIJY6fZmSMGZ0gR8VaouhFwSXo,98,37,10,6,0,1,3,1,0,0,0,0,0,27,0,0,0,1,1,9,0,0,0,0,0,0,0,0,0,0,96,0.98
"Oatlands College, Mount Merrion, An Charraig Dhubh",Oatlands College,ChIJGyhUuh8JZ0gRQS10AqOfYSE,80,18,6,1,1,1,0,0,0,0,0,2,5,23,6,0,1,1,0,10,0,0,0,0,0,1,0,0,1,0,77,0.96
"St. Joseph’s College, Lucan",St Joseph's College Lucan,ChIJBec_PvByZ0gRKEabUbbEjtA,135,6,21,6,1,45,1,0,0,0,0,6,9,21,6,1,0,1,0,0,0,0,0,0,0,1,0,0,1,0,126,0.93
"Pobail Scoil Íosa, Malahide",Malahide Community School,ChIJ9044O44aZ0gR2UOBS1r-yJw,186,23,24,32,0,4,0,1,0,0,0,7,13,48,2,1,0,5,0,4,0,0,0,0,1,0,7,0,1,0,173,0.93
"*Rathdown School, Glenageary",Rathdown School,ChIJfdBx3CwGZ0gR2xPZc_h2D1E,62,19,18,1,0,2,2,0,0,0,0,0,0,9,0,0,0,0,0,4,0,0,0,0,0,0,0,0,0,0,55,0.89
"Loreto College, Swords",Loreto College,ChIJb7c6cfwQZ0gRbD3Dg1CD4Kw,121,11,8,26,0,9,0,0,0,0,0,8,11,17,0,0,0,5,1,2,0,0,0,0,0,0,3,0,2,2,105,0.87
"Portmarnock Community School, Carrickhill Road, Portmarnock",Portmarnock Community School,ChIJTW5F1OgaZ0gRetxSKypfEVc,130,4,13,23,1,6,0,1,0,0,0,5,9,34,1,0,0,4,0,4,0,0,0,1,0,1,2,0,1,0,110,0.85
"Loreto Secondary School, Balbriggan",Loreto Secondary School Balbriggan,ChIJ0-ZbYSgaZ0gRapzDD-dG4-E,196,11,27,30,0,15,4,2,1,1,0,3,10,24,3,1,0,17,2,3,0,0,0,0,0,0,5,0,5,0,164,0.84
"St Raphaela’s Sec School, St. Raphaela’s Road, Stillorgan, Blackrock",St Raphaelas Secondary School,ChIJeUmiRhMJZ0gRxXjA827coLE,72,17,8,2,0,0,0,0,0,0,0,2,1,16,6,0,0,0,0,7,0,0,0,0,0,0,0,0,0,0,59,0.82
"Donabate Community College, Portrane Road, Donabate ",Donabate Community College,ChIJL48CfCgaZ0gRLs1AkLu1iRk,79,9,7,10,1,8,0,0,0,0,0,2,3,18,1,0,0,3,0,1,0,0,0,0,0,0,0,0,1,0,64,0.81
"Coláiste Cois Life, Gleann an Ghrifin, Leamhcan",Coláiste Cois Life,ChIJnW4AqP9yZ0gR8XmCOP4oPSc,76,5,1,6,0,34,0,0,0,0,0,2,0,7,3,1,0,0,0,0,0,0,0,0,0,0,1,0,1,0,61,0.8
"Dominican College, Cross Avenue,, Blackrock",Dominican College Sion Hill,ChIJ-UioQdsIZ0gRwAHOnjq8sko,48,12,4,0,0,0,0,0,0,0,0,0,2,15,1,0,0,0,0,4,0,0,0,0,0,0,0,0,0,0,38,0.79
"Coláiste Padraig CBS, Roselawn, Lucan",Coláiste Phádraig,ChIJ-eKNHvpyZ0gRWhvfJ9hcIfI,137,6,4,1,0,28,0,1,0,0,0,5,12,26,15,2,0,1,0,0,1,0,0,0,1,0,0,0,0,0,103,0.75
"Skerries Community College, Skerries",Skerries Community College,ChIJY66CO6cYZ0gRTHRN8q8onVo,137,9,10,31,0,1,2,0,0,0,0,2,10,16,0,1,0,8,2,2,0,1,0,0,0,0,2,0,4,1,102,0.74
"Clonkeen College, Clonkeen Road, Blackrock",Clonkeen College,ChIJZzaAiGMIZ0gRozqf8i7vMnU,77,15,3,0,0,0,2,0,0,0,0,0,0,21,0,0,0,0,0,12,0,0,0,0,0,0,0,0,0,0,53,0.69
"Newpark School, Newtownpark Avenue, Blackrock",Newpark Comprehensive School,ChIJn3rZp-wIZ0gRDC17B3XLZkw,126,33,9,3,3,4,1,0,0,0,0,1,0,13,2,0,0,0,0,13,0,0,0,0,0,0,0,0,4,0,86,0.68
"Lucan Community College, Esker Drive, Lucan",Lucan Community College,ChIJ-2l4F1NyZ0gRTC4slxmLohE,136,13,10,9,1,21,0,2,0,0,0,4,2,22,7,0,0,0,0,0,0,0,0,0,0,0,0,0,1,0,92,0.68
"St Joseph’s Secondary School, Rush",St Joseph's Secondary School,ChIJt2pZiTYZZ0gR7vaNvTOnZ24,83,6,2,16,0,1,1,0,0,0,0,0,7,9,3,0,0,7,0,0,0,0,0,1,0,0,1,0,2,0,56,0.67
"Balbriggan Community College, Pine Ridge, Chapel St., Balbriggan",Balbriggan Community College,ChIJb5UkYd0iZ0gRGJZK2K4rwLQ,67,1,4,6,0,2,0,2,0,0,0,3,1,9,0,0,0,13,0,1,2,0,0,0,0,0,0,0,0,0,44,0.66
"Adamstown Community College, Station Road, Adamstown, Lucan",Adamstown Community College,ChIJF1FWxLdzZ0gRIjHPW2gRdT0,100,2,5,1,0,14,0,0,0,0,0,5,3,19,12,0,0,1,1,1,0,0,0,0,0,0,0,0,0,0,64,0.64
"Presentation Convent, Rockford Manor, An Charraig Dhubh",Rockford Manor Secondary School,ChIJh1EtkpEIZ0gR1lMjFQUd-zc,37,5,1,2,0,0,0,0,0,0,0,2,0,6,1,0,0,0,0,4,1,0,0,0,0,0,0,0,0,0,22,0.59
"Rathcoole Community School, Crockshane, Kilteel Road, Rathcoole",Holy Family Community School,ChIJiUJETZ52Z0gR9TNtEEFE4w8,162,6,6,3,0,20,0,0,0,0,0,4,3,13,30,1,0,1,0,1,4,0,0,1,0,0,0,0,0,1,94,0.58
"Fingal Community College, Seatown Road, Swords",Fingal Community College.,ChIJM_uRoe4QZ0gR2bS_cASQudw,88,2,3,12,0,1,0,0,0,0,0,8,8,11,1,0,0,4,1,0,0,0,0,0,0,0,0,0,0,0,51,0.58
"Coláiste Choilm, Dublin Road, Swords",Colaiste Choilm,ChIJ_wnlF1QQZ0gRrao21xJr61Q,114,4,3,12,0,2,0,0,0,0,0,5,12,18,1,1,0,6,0,0,0,0,0,0,0,0,0,0,0,0,64,0.56
"St Finians Community College, Castlefarm, Jugback Lane, Swords",Saint Finian's Community College,ChIJoebRcugQZ0gRKrhmOcCyL_E,81,1,2,8,0,3,0,0,0,0,0,6,6,7,3,1,0,1,0,1,0,0,0,1,0,0,2,0,1,0,43,0.53
"Holy Child Community School, Pearse St., Sallynoggin",Holy Child Community School,ChIJhclf1NQHZ0gRqkTi7pewHJk,20,0,1,1,0,0,0,0,0,0,0,2,2,3,0,0,0,0,0,1,0,0,0,0,0,0,0,0,0,0,10,0.5
"Ardgillan Community College, Castlelands, Balbriggan",Ardgillan Community College,ChIJA93pFesiZ0gRxLWlaH1FrI4,75,2,0,0,1,3,0,0,0,0,0,2,1,5,0,0,0,9,0,4,0,0,0,0,2,0,0,0,0,0,29,0.39
"*Belvedere College, Great Denmark Street",Belvedere College SJ,ChIJTcaPW4cOZ0gRVgqU3H63398,160,35,36,45,1,5,1,0,0,0,0,0,4,15,2,0,0,0,0,4,1,0,0,0,0,0,0,0,2,2,153,0.96
"Mount Carmel Sec School, Kings Inn St",Mount Carmel Secondary School,ChIJ34uYDdUNZ0gRwBp3Fy-23Jo,49,1,5,3,0,4,0,0,0,0,0,3,0,5,2,1,0,2,0,2,0,0,0,1,0,0,0,0,0,0,29,0.59
"Larkin Community College, Champion’s Avenue, Cathal Brugha St.",Larkin Community College,ChIJgTCQFoYOZ0gRq3gV0jEBcuo,57,2,1,2,0,2,0,0,0,0,0,1,2,3,1,0,0,0,0,0,0,0,0,0,0,0,0,0,0,0,14,0.25
"*Catholic University School, 89 Lower Leeson Street",Catholic University School,ChIJt9cchZgOZ0gRwW78_VEIEXw,72,12,12,16,1,6,1,0,0,0,0,1,2,21,0,0,1,0,0,3,0,0,0,0,0,0,0,0,1,2,79,1.1
"*Loreto College St. Stephen’s Green, 53 St. Stephens Green","Loreto College, St. Stephen's Green",ChIJjXO-8JgOZ0gR1KHY3XocqDU,90,25,24,15,1,6,0,0,0,0,0,0,0,15,0,0,0,0,0,1,1,0,0,0,0,0,1,0,4,2,95,1.06
"Christian Brothers Westland Row, Westland Row",CBS Westland Row,ChIJ6fclDJEOZ0gRzisvsLddjNo,23,0,0,0,0,1,0,0,0,0,0,0,1,4,0,1,0,0,0,2,0,0,0,0,0,0,0,0,0,0,9,0.39
"Holy Faith Secondary School, 1 Belgrove Road, Clontarf ",Holy Faith Secondary School,ChIJVW-MeacPZ0gRiG5B8ZEvSbI,100,20,22,18,0,7,1,0,0,0,0,2,0,16,1,0,0,0,0,1,0,0,0,0,0,0,4,0,4,0,96,0.96
"Mount Temple, Comprehensive School, Malahide Road",Mount Temple Comprehensive School,ChIJf41O4k0OZ0gR4JrV1ImtDfs,132,13,27,20,0,8,2,0,0,0,0,3,2,19,1,0,0,1,0,5,1,1,1,0,0,0,0,0,7,1,112,0.85
"Scoil Ioseph Naofa, Fionnradharc, Dublin 3 ",Fairview,ChIJ93t8mVAOZ0gR9xWLr9Z6oCE,39,0,4,2,0,2,0,0,0,0,0,2,0,4,1,0,0,0,0,0,0,0,0,0,0,0,0,0,0,0,15,0.38
"Marino College, 14/20 Marino Mart, Fairview",Marino College,ChIJl0jgDVoOZ0gRlsWNguX40-g,38,0,1,0,1,0,0,0,0,0,0,1,1,0,0,0,0,0,0,0,0,0,0,0,0,0,0,0,0,0,4,0.11
"*St. Michael’s College, Ailesbury Road",St.Michael’s College,ChIJA5XXN9IOZ0gR7HGnIVFQrI8,101,51,17,6,1,1,0,0,0,0,0,0,0,30,0,1,0,0,1,3,1,0,0,0,0,0,1,0,0,2,115,1.14
"Muckross College, Marlborough Road, Donnybrook",Muckross Park College,ChIJXa4Sy7AOZ0gRJLi1wQFCeGM,108,45,24,4,1,4,1,1,0,0,0,0,0,20,3,0,0,1,0,5,0,0,0,0,0,0,1,0,0,0,110,1.02
"*St Conleth’s College, Clyde Road",St Conleth's College,ChIJMzkwBLkOZ0gRA5h-cnVypzc,52,18,15,1,0,0,2,0,0,0,0,0,0,9,0,0,0,1,0,2,0,0,0,0,0,0,0,0,1,2,51,0.98
"*The Teresian School, 12 Stillorgan Road",The Teresian Junior School,ChIJHfzGRcsOZ0gRkww9E1MKUTc,24,10,8,1,0,0,1,0,0,0,0,0,0,1,0,0,0,0,0,0,0,0,0,0,0,0,0,0,0,1,22,0.92
"*John Scottus Secondary School, 72-76 Morehampton Road, Donnybrook",John Scottus Primary School,ChIJGwCYdMAOZ0gRtQztOr_mVvE,22,3,3,2,0,0,0,0,0,0,0,1,0,6,1,0,0,0,0,2,0,0,0,0,0,0,0,0,0,0,18,0.82
"Marian College, Ballsbridge",Marian College,ChIJ_3kBDcMOZ0gRNFzZqN7YWmI,63,6,3,0,0,3,0,0,0,0,0,3,2,5,1,0,0,1,0,3,0,0,0,0,0,0,0,0,0,1,28,0.44
"Ringsend College, Cambridge Road, Ringsend",Ringsend College,ChIJcSY-luUOZ0gRSH0iqkCIp7Q,41,4,2,3,1,1,0,0,0,0,0,1,1,1,0,0,0,0,0,0,1,0,0,0,0,0,0,0,0,0,15,0.37
"Manor House School, Watermill Road, Raheny",Manor House School,ChIJOcXrR4wPZ0gRtJmGoEsaB5E,139,10,7,24,0,5,0,0,0,0,0,7,7,26,3,0,0,0,0,2,0,0,0,0,0,0,2,0,1,0,94,0.68
"St Mary’s Holy Faith Secondary School, Holy Faith Convent, Brookwood Meadow, Killester",St Mary's Holy Faith Killester,ChIJeZUf-LgPZ0gRGYsGJYSXIiY,57,4,1,7,0,1,0,0,0,0,0,3,8,10,1,0,0,1,0,0,0,0,0,0,0,0,0,0,1,0,37,0.65
"St. David’s Secondary School, Artane",St David's CBS,ChIJMxmZYMoPZ0gRbXbekWcJZBY,56,0,1,8,0,0,0,0,0,0,0,3,4,7,1,0,0,1,0,1,0,0,0,0,0,0,0,0,1,0,27,0.48
"St Paul’s College, Sybil Hill, Raheny",St Pauls College,ChIJsVbXm5YPZ0gRvLrYA0BVJPo,83,2,5,10,0,0,0,0,0,0,0,3,7,9,2,0,0,0,0,0,1,0,0,0,0,1,0,0,0,0,40,0.48
"Mercy College, St. Brendan’s Drive, Coolock",Mercy College,ChIJJSbJZ8EPZ0gRA-NB30ALH0Y,56,3,0,6,0,1,0,0,0,0,0,7,2,4,0,0,0,0,0,0,0,0,0,0,1,1,0,0,0,0,25,0.45
"Chanel College, Coolock Village, Malahide Road",Chanel College,ChIJccNmklAOZ0gRSfc-y0rHgoo,88,1,3,9,0,1,0,0,0,0,0,6,7,5,0,0,0,0,0,0,0,0,1,0,0,0,0,0,0,0,33,0.38
"Ardscoil La Salle, Raheny Road, Raheny",Ardscoil La Salle,ChIJRTnpiPYPZ0gRfwdqNHsDShw,40,1,0,3,0,0,0,1,0,0,0,2,3,3,1,0,0,0,0,1,0,0,0,0,0,0,0,0,0,0,15,0.38
"*St Mary’s College, Rathmines",st.marys collage,ChIJzZS7sB0MZ0gRnVtm8nw3UB8,71,35,12,2,1,2,2,0,0,0,0,0,1,16,4,1,0,0,0,1,0,0,0,0,0,0,0,0,3,1,81,1.14
"*Stratford College, 1 Zion Rd, Rathgar",Stratford College,ChIJTf7MoOGZXUgRwRXybUQwW0w,13,0,6,0,0,0,0,0,0,0,0,0,0,2,1,1,0,1,0,2,0,0,0,0,0,0,0,0,1,0,14,1.08
"*Sandford Park School, Sandford Road, Ranelagh",Sandford Park School,ChIJEw-t4K8OZ0gRtXXrNoS5rUg,42,13,12,0,0,2,3,0,0,0,0,1,0,10,0,0,0,0,1,1,0,0,0,0,0,1,0,0,1,0,45,1.07
"*Gonzaga College, Sandford Road",Gonzaga College SJ,ChIJE9plmK0OZ0gRp6U5PNFwx3M,91,43,39,1,1,0,0,0,0,0,0,0,0,7,0,1,0,0,0,3,0,0,0,0,0,1,0,0,0,1,97,1.07
"*The High School, Zion Rd, Rathgar",The High School,ChIJO0CsCvoLZ0gRSa1JGt_S_So,125,37,29,5,2,5,1,0,1,0,0,1,2,27,3,1,0,0,0,13,0,0,0,0,0,0,0,0,1,1,129,1.03
"St Louis High School, Rathmines",St Louis High School,ChIJ80PzXQMMZ0gRSqACTokOwEQ,92,15,15,4,0,5,0,0,0,0,0,1,1,28,9,0,0,0,0,2,0,0,0,1,0,0,1,0,0,0,82,0.89
"*Alexandra College, Milltown",Alexandra College,ChIJDXWDrlMJZ0gR6xv1PeH6JPs,69,28,14,2,1,0,1,1,0,0,0,0,2,9,0,0,0,0,0,2,0,0,0,0,0,0,0,0,0,0,60,0.87
"Presentation College, Terenure Park, Terenure",Presentation Community College Terenure CDETB,ChIJ0WqCvooLZ0gRRU8sPZkXj8E,45,5,5,3,0,1,0,0,0,0,0,2,0,8,6,0,0,0,0,1,0,0,0,0,0,0,0,0,0,0,31,0.69
"Rathmines College, Town Hall, Rathmines Road",Rathmines College,ChIJq31lIx0MZ0gR_uek0Ecfcog,116,9,11,5,0,10,0,1,0,1,0,3,4,0,0,0,0,6,0,0,0,0,0,0,0,0,0,0,1,0,51,0.44
"Templeogue College, Templeogue",Templeogue College,ChIJTf7MoOGZXUgRBYTgD0EubNs,109,23,11,3,0,4,0,0,0,0,0,2,2,40,23,0,1,0,0,2,0,0,0,0,0,0,1,0,0,0,112,1.03
"Our Lady’s School, Templeogue Rd, Terenure",Our Ladys School,ChIJxbjr1ZELZ0gRzCsIoxUOgsQ,114,26,11,12,1,7,0,1,0,0,0,2,1,22,19,0,0,1,0,0,0,0,0,0,0,0,5,0,0,0,108,0.95
"*Terenure College, Templeogue Road, Terenure",Terenure College,ChIJE0L8A_ULZ0gRJjWBqEZZ6KQ,104,29,14,5,0,8,0,0,0,0,0,1,2,28,7,0,0,0,0,0,0,0,2,1,0,0,0,0,0,1,98,0.94
"St. Macdara’s Comm. College, Wellington Lane, Templeogue",St. Mac Dara’s Community College,ChIJ_4mWq3ELZ0gRHFQXCcJLiGI,158,17,6,9,1,5,1,0,0,0,0,2,1,30,30,1,0,0,0,2,4,0,0,0,0,0,0,0,3,0,112,0.71
"St. Joseph’s Secondary School, Stanhope Street",Stanhope Street Girls (St Joseph's) Secondary School,ChIJS9NxmC0MZ0gR2r8cHtI3FJ0,31,1,3,3,0,5,0,0,0,0,0,1,0,3,4,0,0,1,0,0,1,0,0,0,0,0,0,0,1,0,23,0.74
"Scoil Dheaglain, Scoil na mBraithre, Bothar Neifin, Baile Atha Cliath 7 ",Saint Declan's Road,ChIJu-wpTkUOZ0gRJmkWcYVCGTE,102,3,4,16,0,12,0,0,0,0,0,11,4,18,1,0,0,0,0,1,0,0,0,0,0,0,0,0,0,0,70,0.69
"St Dominic’s College, Cabra",St Dominic's College,ChIJqRkiJjYLZ0gRuR8rb9_c8tA,155,11,7,22,0,14,1,0,0,0,0,8,1,22,5,1,0,1,0,3,0,0,0,0,0,0,1,0,2,0,99,0.64
"Coláiste Mhuire na mBraithre, Bóthar Ráth Tó, Baile Atha Cliath 7 ",Coláiste Mhuire,ChIJQ1dm5JUNZ0gRlwxrnENH-m8,35,2,2,3,0,4,0,0,0,0,0,4,1,3,0,1,0,0,1,0,0,0,0,0,0,0,0,0,0,0,21,0.6
"St.Paul’s C.B.S., Nth. Brunswick Street",St Pauls CBS,ChIJZfp7ACwMZ0gRKLYh_v1GL-w,20,0,3,0,0,0,0,0,0,0,0,2,0,6,0,0,0,0,0,0,0,0,0,0,0,0,0,0,0,0,11,0.55
"St Patrick’s Cathedral Grammar School, St Patrick’s Close",St. Patrick's Cathedral Grammar School,ChIJhwYhMSEMZ0gRpW3MaWasXpw,24,2,3,1,0,0,0,0,0,0,0,1,1,9,1,0,0,0,0,2,0,0,0,0,0,0,0,0,1,0,21,0.88
"Synge Street CBS, Synge Street",Christian Brothers Secondary School,ChIJY0yM6x8MZ0gRaNcO_-4tkWs,50,2,5,0,0,0,0,0,0,0,0,2,2,10,4,0,0,0,0,1,1,0,0,0,0,0,0,0,0,0,27,0.54
"Mercy Secondary School, Goldenbridge, Inchicore",Mercy Secondary School,ChIJzQePNF8MZ0gRyD1ql9OBQQc,15,1,2,0,0,2,0,0,0,0,0,0,0,0,1,0,0,0,0,0,1,0,0,0,0,0,0,0,0,0,7,0.47
"James’s Street CBS, Basin Lane",C.B.S James Street,ChIJz2GlbzkMZ0gRjAlaO-2MSNc,26,0,1,0,0,0,0,0,0,0,0,1,0,3,0,0,0,0,0,0,0,0,0,0,0,0,0,0,0,0,5,0.19
"Presentation Secondary School, Warrenmount","Presentation Secondary School, Warrenmount",ChIJj0kt9iIMZ0gRPkbRxEeuTms,30,0,0,0,0,1,0,0,0,0,0,1,0,0,0,0,0,0,0,0,0,0,0,0,0,0,0,0,0,0,2,0.07
"Dominican College, 204 Griffith Ave",Dominican College,ChIJEbrJJ1AOZ0gR5O8ek83cGJ4,114,8,23,43,1,3,0,0,0,0,0,4,1,12,1,1,0,0,0,4,0,0,0,0,0,1,1,0,4,0,107,0.94
"Maryfield College, Glandore Rd, Drumcondra",Maryfield College,ChIJHes9v0YOZ0gRVi-0ty5whoQ,104,8,7,24,0,8,0,1,0,0,0,4,7,24,0,1,0,1,0,1,0,0,0,0,0,0,2,0,5,0,93,0.89
"Ard Scoil Ris, Ascal O Griofa, Baile Atha Cliath 9",Ardscoil Rís Secondary School,ChIJBStN008OZ0gRvZYZRX2aIFQ,87,3,8,32,1,1,0,0,0,0,0,0,9,15,0,1,0,0,0,2,0,0,0,0,0,0,1,0,0,0,73,0.84
"Scoil Naomh Aodhan, Ascal Ui Choileain, Fionnbhru, Baile Atha Cliath 9",Ascaill Uí Choileáin,ChIJUa0c4xYOZ0gRXIzLEsd4-8k,119,3,3,32,0,6,0,0,0,0,0,18,8,23,0,0,0,0,0,1,1,0,0,0,0,0,0,0,0,0,95,0.8
"Scoil Chaitriona, Bothar Mobhi, Glasnaion, Baile Atha Cliath 9",Scoil Chaitríona,ChIJrwJxZnIOZ0gRgO699T9bpfU,69,3,9,18,0,3,0,0,0,0,0,7,2,3,0,0,0,0,0,0,0,0,0,0,0,0,1,0,2,0,48,0.7
"Our Lady of Mercy College, Beaumont",Our Lady of Mercy College (Secondary School),ChIJyZbgEzEOZ0gRp4xuNbC7RCQ,60,1,2,7,0,3,0,0,0,0,0,4,3,8,0,1,0,0,0,0,0,0,0,0,0,0,0,0,1,0,30,0.5
"Mgt. Aylward Comm. College, Thatch Road, Whitehall",Margaret Aylward Community College,ChIJWVnoZzkOZ0gRPOyPt4MrSOg,24,0,0,0,1,1,0,0,0,0,0,5,2,2,0,0,0,0,0,0,0,0,1,0,0,0,0,0,0,0,12,0.5
"Rosmini Community School, O’Donnell House, All Hallows College, Gracepark Road",Rosmini Community School,ChIJ7csHZUIOZ0gRJKCA10az3Q8,21,0,1,2,0,1,1,0,0,0,0,1,0,2,0,0,0,0,0,1,0,0,0,0,0,0,0,0,0,0,9,0.43
"Plunkett College, Swords Road, Whitehall",Plunket College,ChIJ5eClWRUOZ0gRr6TcYvl8g04,92,2,2,3,1,7,0,2,0,0,0,4,4,5,0,0,0,3,0,1,0,0,0,0,0,0,0,1,1,0,36,0.39
"Trinity Comprehensive School, Main Street, Ballymun",Trinity Comprehensive School,ChIJCepnExsOZ0gRpP7AwBJWD2Y,45,0,0,3,0,1,0,0,0,0,0,5,2,5,0,0,0,1,0,0,0,0,0,0,0,0,0,0,0,0,17,0.38
"Caritas College, Drumfin Road, Ballyfermot",Caritas College,ChIJlfu4L98MZ0gRhnFiO24csQ4,25,0,0,1,0,5,0,0,0,0,0,2,1,4,1,0,0,0,0,0,0,0,0,0,0,0,0,0,0,0,14,0.56
"St Johns College De La Salle, Le Fanu Rd, Ballyfermot","St. John's College, De La Salle",ChIJpYgcwd0MZ0gRjQnpu36bME8,59,1,2,0,0,7,0,0,0,0,0,3,1,3,6,0,0,0,0,0,0,0,0,0,0,0,0,0,0,0,23,0.39
"Kylemore College, Kylemore Road, Ballyfermot",Kylemore Music College,ChIJnSyUROcMZ0gRL47Ra8_IBo0,42,0,1,1,0,3,0,0,0,0,0,3,0,0,3,0,0,0,0,0,0,0,0,0,0,0,0,0,1,0,12,0.29
"St. Dominic’s Secondary School, Kylemore Road, Ballyfermot",St Dominic's College Ballyfermot,ChIJt2u17OYMZ0gRnzUqyruENxY,52,0,1,1,1,1,0,0,0,0,0,2,0,3,4,0,0,0,0,0,1,0,0,0,0,0,0,0,0,0,14,0.27
"St. Mary’s Secondary School, Holy Faith Convent, Glasnevin",ST MARY'S SECONDARY SCHOOL,ChIJhYzw5HQOZ0gRv34MrIS4W3U,134,5,13,20,0,6,0,0,0,0,0,6,9,21,1,0,0,2,0,0,0,0,1,0,0,0,0,0,3,1,88,0.66
"Christian Brothers, St. Kevin’s College, Ballygall Road East, Finglas",St Kevin's College,ChIJAfBFJ-ANZ0gRSZ1RwrvRkCE,85,0,1,15,1,1,0,0,0,0,0,13,3,14,2,0,0,0,0,1,0,0,0,0,0,1,0,0,0,0,52,0.61
"St. Vincent’s CBS, Secondary School, Finglas Road, Glasnevin",St. Vincent's Secondary School,ChIJQWgiFdgNZ0gRhHsNhueRBcw,45,0,2,2,0,0,0,0,0,0,0,6,1,7,3,0,0,0,0,0,1,0,0,0,0,0,0,0,0,0,22,0.49
"St Michael’s Secondary School, Wellmount Road, Finglas",St. Michael's Holy Faith Secondary School,ChIJpWuLcPINZ0gR4cpPDIii3eU,85,0,1,3,0,8,0,0,0,0,0,8,4,9,0,0,0,0,0,1,0,1,0,0,0,0,0,0,2,0,37,0.44
"Beneavin College, Beneavin Road, Finglas",Beneavin De La Salle College,ChIJK30SbvsNZ0gRtwlLvR9UtB4,51,1,3,2,0,1,0,0,0,0,0,6,1,2,0,1,0,0,0,0,1,0,0,0,0,0,0,0,0,0,18,0.35
"New Cross College, Cappagh Rd., Finglas",New Cross College,ChIJJXYia4YNZ0gR9bbiEPgvHnY,23,1,1,0,0,0,0,0,0,0,0,2,0,1,0,0,0,0,0,1,0,1,0,0,0,0,0,0,0,0,7,0.3
"Coláiste Eoin, Cappagh Road, Finglas",Coláiste Eoin,ChIJ1Z8WpicJZ0gRpR_TROqJEjM,13,0,1,0,0,0,0,0,0,0,0,0,0,0,0,0,0,0,0,0,0,0,0,0,0,0,0,0,0,0,1,0.08
"St Paul’s Secondary School, Greenhills",St Pauls Secondary School,ChIJmTkt62ILZ0gR-K3LLhbT3cs,81,10,3,1,0,8,0,1,0,0,0,2,2,10,13,0,0,0,0,2,0,0,0,0,1,1,1,0,2,0,57,0.7
"Loreto College, Crumlin Rd",Loreto College,ChIJ89zYu2sMZ0gRcqmjMf6MmY8,75,3,8,1,0,6,0,0,0,0,0,2,2,7,6,0,0,1,0,1,2,0,1,0,0,0,0,0,0,0,40,0.53
"Pearse College, Clogher Road, Crumlin",Pearse College of Further Education,ChIJG5PPkGwMZ0gR_WXfzqYWkTI,54,4,4,1,0,4,1,0,0,0,0,4,0,2,0,0,0,0,1,0,3,0,1,1,1,0,0,0,1,0,28,0.52
"Mean Scoil Iognaid Ris, Caislean Druimnigh, Dublin12",Drimnagh Castle Primary,ChIJCdMvZ44MZ0gRGhejA8_DD9c,124,3,3,1,0,6,0,0,0,0,0,0,2,22,23,0,0,0,0,1,0,0,0,0,0,1,0,0,0,0,62,0.5
"Greenhills College, Limekiln Avenue, Greenhills","Greenhills College, Dublin - Secondary & Further Education",ChIJOaLpEGILZ0gRn5Jj26RwOPs,24,0,1,0,0,0,0,0,0,0,0,0,0,0,8,0,0,1,0,0,1,0,0,0,0,0,0,0,0,0,11,0.46
"Assumption Sec School, Walkinstown",Assumption Secondary School Walkinstown,ChIJsX6Sy48MZ0gRx4KaFwYTrO4,55,0,4,0,0,7,0,0,0,0,0,1,0,4,3,0,0,1,1,1,1,0,0,0,0,0,0,0,1,0,24,0.44
"Rosary College, Armagh Road, Crumlin",Rosary College,ChIJAYUNmrsNZ0gRNmiOR4f31QA,20,0,0,0,0,1,0,0,0,0,0,0,0,2,4,0,0,0,0,0,1,0,0,0,0,0,0,0,0,0,8,0.4
"Ardscoíl Éanna, 314-318 Crumlin Rd.",Ardscoil Eanna,ChIJ8Q_3rWYMZ0gRQFWv8T4UAYs,27,0,2,0,0,1,0,0,0,0,0,1,0,0,3,0,0,0,0,1,0,0,0,0,0,0,0,0,1,0,9,0.33
"Our Lady of Mercy Sec School, Mourne Road, Drimnagh",Our Lady of Mercy Secondary School,ChIJlWpdcmAMZ0gRlPTwl622djI,49,2,3,0,0,0,0,0,0,0,0,1,1,1,4,0,0,0,0,0,0,0,0,1,0,0,0,0,0,0,13,0.27
"St. Kevin’s College, Cloghar Road, Crumlin",St Kevin's College,ChIJkRSln2wMZ0gRxm3JeX16YXE,12,1,0,0,0,0,0,0,0,0,0,0,0,0,0,0,0,0,0,0,0,0,0,0,0,0,0,0,0,0,1,0.08
"Santa Sabina Dominican College, Greenfield Road, Sutton",Santa Sabina Dominican College,ChIJt05F690EZ0gRoGGvRpEnJuw,107,20,16,27,1,2,1,0,0,0,1,0,3,16,1,0,0,3,0,0,0,0,0,1,0,1,2,0,5,0,100,0.93
"St. Fintan’s High School, Sutton",St Fintans High School,ChIJd_Nc6SMFZ0gReIvr5-tzH4w,90,17,15,19,0,3,1,0,0,0,0,3,5,16,0,0,0,0,0,3,0,0,0,0,0,0,0,0,0,1,83,0.92
"*Sutton Park School, St. Fintans Road, Sutton",Sutton Park School,ChIJBZdeX-UEZ0gRunCr2gJIye4,40,3,14,5,0,0,0,0,0,0,0,3,0,4,1,0,0,0,0,4,0,0,0,0,0,0,0,0,0,0,34,0.85
"Gaelcholáiste Reachrann, Br. Mhainistir na Gráinsí, Domhnach Míde, Baile Átha Cliath 13 ",Gaelcholáiste Reachrann,ChIJH00PjFEFZ0gRKKm9HJIJmgI,51,2,5,13,1,1,0,0,0,0,0,0,0,6,0,1,0,0,0,0,0,0,0,0,0,1,1,0,1,0,32,0.63
"St Mary’s Secondary School Baldoyle, College Street, Baldoyle ",Saint Mary's School For Girls,ChIJsROzFTAFZ0gRs5C2xlR73qU,40,4,0,5,0,1,0,0,0,0,0,0,1,6,0,0,0,0,0,1,0,0,0,0,0,0,0,0,1,0,19,0.48
"Community School, The Donahies, Streamville Road ",The Donahies Community School,ChIJhbHnVvcPZ0gR5Le8guTEndo,55,1,1,2,0,2,0,0,0,0,0,7,0,6,0,0,0,0,0,0,0,0,0,0,0,0,0,0,0,0,19,0.35
"Pobalscoil Neasáin, Baldoyle ",Pobalscoil Neasain,ChIJMTVS2DsFZ0gRPrpBVOt2QI0,84,2,2,1,0,0,0,0,0,0,0,3,3,8,0,0,0,1,0,3,0,0,0,0,0,0,1,0,0,0,24,0.29
"Grange Community College, Grange Abbey Road, Donaghmede ",Grange Community College,ChIJU4aN_FkFZ0gRnfEwg13Gq_0,22,0,0,0,0,0,0,0,0,0,0,2,0,3,0,0,0,1,0,0,0,0,0,0,0,0,0,0,0,0,6,0.27
"*Mount Anville, Goatstown ",Mount Anville,ChIJmVtz-BUJZ0gRc4-xLAhJwfY,93,52,17,6,2,0,2,0,0,0,0,0,1,19,1,0,0,0,0,5,0,0,0,0,0,0,0,0,0,0,105,1.13
"*Loreto High School, Beaufort, Grange Road, Rathfarnham",Loreto High School Beaufort,ChIJb-JGxeoLZ0gR4ohS9ssu_Ic,96,34,21,4,0,5,0,1,0,0,0,0,0,21,1,0,0,0,0,5,0,0,0,0,0,0,6,0,2,2,102,1.06
"*Notre Dame School, Upper Churchtown Road",Notre Dame School,ChIJBajETeQLZ0gRZHwHNyFFXWc,21,6,3,2,0,1,0,0,0,0,0,0,0,7,1,0,0,0,0,1,0,0,0,0,0,0,1,0,0,0,22,1.05
"Jesus and Mary College, Our Lady’s Grove, Goatstown","Jesus and Mary College, Our Lady’s Grove",ChIJzZbu9UYJZ0gRolrQGWvkBjE,42,10,7,0,0,3,0,1,0,0,0,0,0,10,5,1,0,0,0,3,0,0,0,0,0,0,1,0,2,0,43,1.02
"*Deutsche Schule, St. Kilian’s, Roebuck Road, Clonskeagh",St Kilian's German School,ChIJcY7zEjkJZ0gRFHH36MF-f88,39,12,8,2,0,0,3,1,0,0,0,0,0,6,0,0,0,0,0,5,0,0,0,0,0,0,0,0,0,0,37,0.95
"De La Salle College, Churchtown, Rathfarnham",Rathfarnham,ChIJrRo8F74LZ0gRTae69UiuD9o,58,10,5,1,0,1,0,0,0,0,0,2,1,8,3,0,1,0,0,1,0,0,0,0,1,0,0,0,0,0,34,0.59
"*St. Vincent’s Castleknock College, Castleknock",Castleknock College,ChIJmRJw4zgNZ0gRMDnnNkBFwjw,80,11,18,10,1,17,2,0,0,0,0,1,1,7,1,0,0,0,0,4,1,0,0,0,0,0,0,0,1,0,75,0.94
"Castleknock Community College, Carpenterstown Road, Castleknock",Castleknock Community College,ChIJl4YMnLVyZ0gRw10fiexSisM,187,24,17,26,0,41,3,0,1,0,0,21,3,15,3,0,0,1,0,2,0,0,0,0,0,0,1,0,0,0,158,0.84
"Coláiste Pobail Setanta, Phibblestown, Clonee",Coláiste Pobail Setanta College,ChIJ_Vj00GRtZ0gRRX_whCP8XkU,103,7,9,8,0,20,0,0,0,0,0,17,3,12,3,0,0,3,0,0,0,1,0,0,0,0,2,0,0,0,85,0.83
"Coolmine Community School, Clonsilla",Coolmine Community School,ChIJZxbEnbNyZ0gRoPcRGFPJ1xA,179,9,9,16,1,25,0,0,1,0,0,35,3,23,2,1,0,2,0,2,0,0,0,0,0,0,0,0,1,0,130,0.73
"Hartstown Community School, Clonsilla",Hartstown Community School,ChIJpT5Wl15tZ0gR49dvIr-fCrM,164,8,4,5,0,27,0,0,0,0,0,28,2,13,2,1,0,2,1,1,0,0,1,0,0,0,1,0,0,2,98,0.6
"Riversdale Community College, Blanchardstown Road North, Blanchardstown",Riversdale Community College,ChIJH5cMm6USZ0gRttVVwR66iGI,50,1,1,1,0,4,0,0,0,0,0,8,0,8,0,0,0,0,0,0,2,0,0,0,0,0,0,0,0,0,25,0.5
"Luttrellstown Community College, Porterstown Road, Clonsilla",Luttrellstown Community College,ChIJtZJ7U7lyZ0gR8Q7U1vuy1FA,79,5,7,0,0,12,0,0,0,0,0,1,0,7,0,0,0,3,0,0,0,0,0,0,0,0,0,0,0,0,35,0.44
"Blakestown Community School, Blakestown, Blanchardstown",Blakestown Community School,ChIJL4DBH1dtZ0gRq6FqjImRNQE,83,0,3,1,0,5,0,0,0,0,0,14,2,3,0,3,0,0,1,0,1,0,0,0,0,0,0,0,2,0,35,0.42
"St Colmcilles Community School, Scholarstown Rd, Knocklyon",Saint Colmcilles Community School,ChIJs3ejvggLZ0gRshx89-VH0RU,113,20,14,22,0,6,0,0,0,0,0,0,2,35,11,0,1,0,1,4,1,0,0,0,0,0,0,0,3,1,121,1.07
"*Wesley College, Ballinteer",Wesley College,ChIJL0kIRnsJZ0gRNN_Bt-RgjUA,141,44,23,6,1,2,2,2,0,0,0,0,3,28,5,1,0,0,1,13,0,0,3,1,0,1,0,0,2,2,140,0.99
"Coláiste Eanna na mBraithre, Baile Ruain, Rath Fearnain, Baile Atha Cliath 16",Coláiste Éanna,ChIJX6wDLaMLZ0gRnFOe7dq6A7A,91,23,5,3,1,2,0,0,0,0,0,2,2,25,21,0,0,0,0,4,0,0,0,0,0,0,0,0,0,0,88,0.97
"Sancta Maria College, Ballyroan Crescent, Rathfarnham",Sancta Maria College,ChIJgapcwqMLZ0gR4MsYVHmkqg8,92,17,4,1,0,3,0,0,0,0,0,2,3,13,15,1,0,0,1,5,0,1,0,0,0,0,0,0,2,0,68,0.74
"*Rockbrook Park School, Edmondstown Road, Rathfarnham",Rockbrook Park School,ChIJi6JhIlQKZ0gRD37R_7jExS0,24,2,3,0,0,0,0,0,0,0,0,0,0,6,3,0,0,0,0,1,0,0,0,0,1,0,0,1,0,0,17,0.71
"Ballinteer Community School, Broadford Road, Ballinteer ",Ballinteer Community School,ChIJ10vB4dkLZ0gRBcPziDuiG0w,59,2,2,3,0,2,0,0,0,0,0,0,0,8,7,0,0,0,0,4,0,0,0,0,0,0,0,0,0,0,28,0.47
"St. Tiernan’s Community School, Parkvale, Balally ",St Tiernan's Community School,ChIJA8ncOnAJZ0gR2hgfoqgUcXI,46,2,0,1,1,5,1,0,0,0,0,1,1,1,3,0,0,1,1,1,1,0,0,0,0,0,0,0,0,0,20,0.43
"*College of St Columba, Whitechurch ",St. Columba's College,ChIJ150bjzQKZ0gRM_EOnupsooE,61,3,8,0,0,0,2,2,0,0,0,0,0,3,1,0,0,0,0,0,0,0,0,0,0,0,0,0,0,0,19,0.31
"Coláiste Dhulaigh Post Primary, Barryscourt Road, Coolock",Coláiste Dhúlaigh Post Primary School,ChIJG3PsttAPZ0gRDxp5n2tGksU,29,0,0,0,0,2,0,0,0,0,1,2,1,1,0,0,0,0,0,0,1,0,0,0,0,0,0,0,0,0,8,0.28
"*Loreto Secondary School, Springfield Park, Foxrock",Loreto College,ChIJv1UijVgIZ0gRf9z4Ak38d_o,111,50,13,11,0,2,0,0,0,0,0,0,1,20,1,0,0,2,0,11,0,0,0,0,0,2,5,0,2,1,121,1.09
"*Rosemont Park School, Enniskerry Road, Sandyford",Rosemont School,ChIJnSeL45kJZ0gRig6Xpxf4Iw4,17,5,3,1,1,0,1,0,0,0,0,0,0,2,1,0,0,0,0,1,0,0,0,0,0,0,1,0,0,0,16,0.94
"St. Laurence College, Loughlinstown",St Laurence College,ChIJ0dCMsgsIZ0gRNx7T-Ml2U50,35,9,2,0,0,1,0,0,0,0,0,1,4,3,2,1,1,0,1,1,1,0,0,0,0,0,0,0,0,0,27,0.77
"Community School, Cabinteely",Cabinteely Community School,ChIJ6c9fHnEIZ0gR9GS-i7lijGE,66,9,2,0,0,1,0,0,0,0,0,0,0,5,2,0,0,0,0,5,3,0,1,0,0,0,0,0,0,0,28,0.42
"*Mount Sackville, Chapelizod",Mount Sackville Secondary School,ChIJ1X9-8iINZ0gR7AigGVmqJV4,84,13,16,17,2,22,0,2,0,0,0,3,2,13,1,0,0,1,0,0,0,0,0,0,0,0,0,0,1,1,94,1.12
"*The Kings Hospital, Palmerstown",The King's Hospital School,ChIJM4yv4NJyZ0gR38vZ__nPLsg,113,14,22,14,0,21,4,0,0,0,0,2,3,5,0,0,0,0,2,2,1,1,0,0,0,0,0,0,0,0,91,0.81
"Pobal Scoil Iosolde, Oak Court Avenue, Palmerstown",Oakcourt Avenue,ChIJ9fIUaNYMZ0gRagrTLvfGmuQ,58,1,0,0,0,3,0,0,0,0,0,3,2,6,7,2,0,1,0,1,1,0,0,0,1,0,0,0,0,0,28,0.48
